jobTitle,jobLocation,applicantsCount,viewsCount,jobPosterProfileUrl,postedAt,appliesClosed,applyUrl,jobDescription,remoteAllowed,companyName,companyUrl,matchedSkills,jobFunctions,jobIndustries,appliesClosedAt,jobType,jobUrl,jobImageUrl,timestamp,query,error
Microsoft Solutions Consultant,"Singapore, Singapore",,7,,2022-03-14T01:04:00.000Z,true,https://careers-softwareone.icims.com/jobs/15661/job,"SoftwareONE is a leading global provider of end-to-end software and cloud technology solutions, headquartered in Switzerland. With an IP and technology-driven services portfolio, it enables companies to holistically develop and implement their commercial, technology and digital transformation strategies. This is achieved by modernizing applications and migrating critical workloads on public clouds, while simultaneously managing and optimizing the related software and cloud assets and licensing. SoftwareONE’s offerings are connected by PyraCloud, its proprietary digital platform, which provides customers with data-driven, actionable intelligence. With around 8,300 employees and sales and service delivery capabilities in 90 countries, SoftwareONE provides around 65,000 business customers with software and cloud solutions from over 7,500 publishers. SoftwareONE’s shares (SWON) are listed on SIX Swiss Exchange. For more information, please visit https://www.softwareone.com/e. <span style=""margin: 0px; padding: 0px; color: windowtext;"" data-ccp-props=""{""201341983"":0,""335551550"":6,""335551620"":6,""335559738"":120,""335559739"":120,""335559740"":288}""> 

SoftwareONE Holding AG, Riedenmatt 4, CH-6370 Stans<span style=""margin: 0px; padding: 0px; color: windowtext;"" data-ccp-props=""{""201341983"":0,""335551550"":6,""335551620"":6,""335559738"":120,""335559739"":240,""335559740"":288}""> 

 



 

 

Solutions Architect - Future Workplace

 

The Solutions Architect (SA) is responsible for driving and co-owning Future Workplace solution sales, business development, and marketing activities within his/her assigned region. The role functions as a partnership with the primary account manager and as a result is not limited to traditional “overlay role” restrictions, the SA is expected to take a consistently proactive approach to developing the technical solutions business in the region. The SA is the technical lead in the region for pre-sales (both transactional and professional services) customer engagements and sales enablement for the respective region. The role also serves as the liaison between the assigned sales team and customers and professional services delivery resources which include both in-house and partner delivered services. The SA will scope professional services opportunities and assist in the creation and delivery of Statements of Work (SoW) to customers. The SA will be required to maintain an advanced level of technical knowledge across a broad set of foundational technologies as well as at least one specific technology set to serve as the subject matter expert for that specific subject on a national and/or global scale.

 

Role Responsibilities

Assisting with account leadership, business development, and managed services teams on our Future Workplace portfolio and how to position and architect our solutions to build customer value and drive revenue growthLeadership and delivery teams during architectural design sessions, key customer workshops, implementation project reviews, and end-to-end solution shapingPartners and co-owns sales activities at a customer level with the field-based account manager (Business Development Manager [BDM])Performance and success measured by GP performance of region and individual accounts. Performance based quarterly incentives will be structured in commission format.Analyze & gather business requirement from large & complexity client environment and perform required research and investigation to identify and create thorough, accurate technical solution proposals based on client requirements.Responsible for partnering with BDMs and local sales leadership to drive net newbusiness opportunities within the existing regional account base as well as supporting customer acquisition activities as assigned.Prepares cost estimates for licensing and product sales as well as professional services (deployment, migration, implementation, workshops, etc.) by studying blueprints, plans, and related customer documents; consulting with other engineers, architects, practice leads and other professional and technical personnel (both internal and external).Develop overall solutions including high-level design (e.g.-Whiteboarding), statements of work (SOW), service design and bills of materials (BOM).Contributes to sales engineering effectiveness by identifying short-term and long-range issues that must be addressed; providing information and commentary pertinent to deliberations; recommending options and courses of action; implementing directives. 

Technology Knowledge

The ideal candidate will demonstrate skills and applicable experience in the following technical roles

O365 - SAAS/IAAS/PaaS expertise (Workloads, App Service, data, server-less)Deliver O365 productivity WorkshopsCreate high and low level design architectureO365 suite - Design, plan, install, configure and maintain Enterprise level-based solutions aligned with business needs.Deliver POCs and convert them into production delivery Technology (Workplace focus)Security Center, OMS and Log AnalyticsIn-depth knowledge of Enterprise Mobility and Security suite (EMS E3/E5)Active Directory Domain Services (ADDS) and AD Connect / DirSync ServicesWintel Server, Clustering and Active Directory Certificate Services (ADCS)Office 365 / M365: on-premise/hybrid Exchange, Exchange Online, OneDrive for Business, SharePoint, OneDrive for Business, Microsoft Teams, AAD Connect and associated Microsoft Collaboration Services.Active Directory Federation Services (ADFS)DirSync, Azure AD identity Sync, or Azure ConnectOffice365 Design and Implementation ProjectsMicrosoft Teams and voice solutionsPowerShell Scripting / Graph APIExchange Server - 2010, or 2013, 2016Understanding of network dependencies, implications & requirements needed for all Office 365 services 

 

 

 

Skills, Qualification & Certifications 

University degree preferred (in the field of Information Technology and/or or equivalent combination of experience and education; Bachelor’s degree preferred).Knowledge of ITSM; ITIL v4; Agile; DevOps;10+ years' experience of architecting and supporting sales of Microsoft Workplace solutions spanning infrastructure, platforms, applications, devices, security, data, experience, and business improvementSales and/or end to end solutioning accountability and track record for a pipeline of $10M+ TCV managed services deals with demonstrable innovation and value creation plus evidence of successful cross and upsell motions.Documented successful sales of enterprise-wide advanced end user computing and mobility solutions.Service design, integration, implementation/transition and lifecycle management including development of performance metrics spanning operations, experience and business valueAbility to independently conduct meetings with engineering-level, management-level or executive level customer personnel in regard to positioning sales and solutions.Workplace services strategy, organization and operations consultancy knowledgeExperience of working within a matrixed business spanning consulting and technology services and onshore/nearshore/offshore delivery centersExperience in leading, implementing, and deploying innovative go-to-market strategies (all sales and marketing initiatives) across large scale services-based opportunities3+ years' of experience in team leadership  

",false,SoftwareONE,https://www.linkedin.com/company/softwareone,,"Consulting, Information Technology, Sales",Information Technology & Services,2022-09-10T01:13:00.000Z,Full-time,https://www.linkedin.com/jobs/view/2964426473/,https://media-exp1.licdn.com/dms/image/C560BAQFv6eCeb93Esg/company-logo_200_200/0/1561965822343?e=1655337600&v=beta&t=BF_qeoXozDjNyD5xRrV_LBpRvb6WqfSIrwnaqPVEXX0,2022-03-14T07:37:24.554Z,https://www.linkedin.com/jobs/view/2964426473/,
IT Support Specialist,"Singapore, Singapore",81,264,,2022-03-09T05:49:44.000Z,false,https://workiva.wd1.myworkdayjobs.com/careers/job/Singapore/IT-Support-Specialist_R4236?source=Linkedin,"Job Summary

IT Support Specialists support the Workiva mission and objectives by ensuring that all employees are equipped with the relevant, functional equipment and software necessary to succeed in their roles. This position provides help desk and end point support to employees and consultants. The IT Support Specialist is empowered to make decisions as to the best way to meet user needs.

Responsibilities
Serves as a point of contact for end-users and provides basic and escalated technical support through in- person or remote communication as part of the Help Desk teamProvides solution-oriented and customer-focused service while adhering to established practices and proceduresAnswers phone calls, emails and messages from internal customers regarding IT issuesTracks the status of issues utilizing a cloud-based systemProvides off-hour assistance on a rotational basisProcesses help desk support tickets by reviewing, categorizing, prioritizing and assigning tickets to the appropriate project and/or personAnalyzes and troubleshoots problems, striving for immediate resolution, and redirecting or escalating as necessaryProvides endpoint support or remote desktop support for Workiva-owned computers, mobile equipment, digital equipment, and applicationsPerforms distribution, installation, and upgrades of applications, device-specific software, and workflowsResearches solutions to unresolved problems using a variety of resourcesApplies knowledge of principles, practices, and procedures of a particular area of specialization to complete difficult assignmentsMay engage in technology-related project work

Skills

What You'll Need
Demonstrated ability to effectively communicate by phone, text, or in personDemonstrable proactive problem solving experienceDemonstrated ability to achieve successful outcomes in handling difficult situations and customersAbility to translate technical terminology into everyday languageDemonstrable technical proficiency to serve in help desk roleAbility to document processes and standardsShows initiative and acts independently to resolve problemsAbility to solve problems and apply previous experience to new problemsAbility to work autonomouslyDemonstrated ability to manage multiple priorities and customer expectationsAbility to work in a demanding, fast-paced environment, and manage multiple projects

Experience
Preferred 2+ years of helpdesk/technical support or related experienceSmall business support background is a plus

Education
Preferred 2 year degree/schooling beyond high school or equivalent work experience

Travel Requirement
Less than 10% travel expected

Working Conditions
Reliable internet access for any period of time working remotely, not in a Workiva office.

Where You’ll Work

Our values drive how we work and who we hire. You will see these values ingrained in how we support our customers, work with team members, build our products and in the work environment we’ve created.
Customer Success: Always delight our customers.Trust: Rely on each other. Integrity: Do the right thing, every time. Collaboration: Share resources and work together. Innovation: Keep creating solutions and finding better ways. Inclusion: Support a diverse community where we all belong. Accountability: Be responsible for your success and failure.

We believe our people are our greatest asset, and our unique culture gives employees the opportunity to make an impact everyday. We give our employees the freedom and resources they need—backed by our culture of collaboration and diverse thought—to continue innovating and breaking new ground. We hire talented people with a wide range of skills and experiences who are eager to tackle some of today’s most challenging problems.

At Workiva, you’ll enjoy:
Casual Dress: Workiva has a casual work environment, most people wear jeans to the office.Involvement: Ability to participate in Employee Resource Groups, (Women in Tech, Women in Sales, Ethnic Diversity, Veterans, Rainbow (LGBTQ), Remote Employees, Caregiving) Volunteering, Company wide celebrations, and moreWork-life Balance: We have competitive PTO, VTO and Parental Leave. We encourage employees to spend time enjoying life outside of work.

Learn more about life at Workiva: https://www.linkedin.com/company/workiva/

Learn more about benefits: https://www.workiva.com/careers/benefits

Workiva is an Equal Employment Opportunity Employer. We believe that great minds think differently. We value diversity of backgrounds, beliefs, and interests, and we recognize diversity as an important source of intellectual thought, varied perspective, and innovation. Employment decisions are made without regard to age, race, creed, color, religion, sex, national origin, ancestry, disability status, veteran status, sexual orientation, gender identity or expression genetic information, marital status, citizenship status or any other protected characteristic.

Workiva is committed to working with and providing reasonable accommodations to applicants with disabilities. To request assistance with the application process, please email talentacquisition@workiva.com.",false,Workiva,https://www.linkedin.com/company/workiva,,Information Technology,Computer Software,2022-04-08T05:49:43.000Z,Full-time,https://www.linkedin.com/jobs/view/2960454053/,https://media-exp1.licdn.com/dms/image/C560BAQHGtsgiZOVMzQ/company-logo_200_200/0/1610366570093?e=1655337600&v=beta&t=nmAO68bQO10HRpVu6QNZreK_jSR_wv-lPsTJqHaZWQw,2022-03-14T07:37:27.699Z,https://www.linkedin.com/jobs/view/2960454053/,
"Software Engineer, Data Engineering","Singapore, Singapore",9,83,,2022-03-07T01:49:40.000Z,false,https://sggovterp.wd102.myworkdayjobs.com/en-US/PublicServiceCareers/job/Singapore/Software-Engineer--Data-Engineering_JR-10000007208?source=Linkedin,"The Government Technology Agency (GovTech) aims to transform the delivery of Government digital services by taking an ""outside-in"" view, putting citizens and businesses at the heart of everything we do. We also develop the Smart Nation infrastructure and applications, and facilitate collaboration with citizens and businesses to co-develop technologies.

Join us as we support Singapore’s vision of building a Smart Nation - a nation of possibilities empowered through info-communications technology and related engineering.

As a Software Engineer in the Data Privacy team of GovTech’s Data Science and Artificial Intelligence Division, you will build platforms and tools to implement Privacy-Preserving Technologies (PP-Tech) in the public sector.

You will be breaking new ground in the frontier space of data privacy through working on impactful and scalable technologies that create new data sharing use cases, while preserving the privacy and utility of the data.

We are looking for enthusiastic and passionate engineers to join us in this journey to make a difference.

What you will be working on:
 Full stack web application development involving frontend, backend and/or cloud infrastructure. Ownership over system design and implementation, with a focus on sound technical choices and maintainability. Execute projects with an Agile mindset Implement cutting edge privacy preserving technologies (e.g. homomorphic encryption, federated learning) in the public sector. Collaborate with product managers, software engineers, researchers, data analysts and data scientists to build scalable and data-driven platforms

What we are looking for:
 Have Degree or Diploma in computing, design or a relevant field of study Have a demonstrated ability to build software Experience in frontend technologies (HTML, CSS and JS/TS) as well as any web framework (React, Angular, Vue etc) Experience in backend JavaScript (Node.js)/TypeScript or other backend frameworks Experience with the cloud (e.g. AWS, GCP, Azure) Familiarity with Git version control and backend experience with REST APIs Interest in web app development and UI/UX design Be a team player Experience in data privacy or cybersecurity is a bonus

We are an equal opportunity employer and value diversity at our company as we believe that diversity is meaningful to innovation. Our employee benefits are based on a total rewards approach, offering a holistic and market-competitive suite of perks. This includes generous leave benefits to meet your work-life needs. We trust that you will get the job done wherever you are, and whatever works best for you – so work from home or take a break to exercise if you need to*. We also believe it’s important for you to keep honing your craft in the constantly-evolving tech landscape, so we provide and support a plethora of in-house and external learning and development opportunities all year round.
Subject to the nature of your job role that might require you to be onsite during fixed hours",false,GovTech Singapore,https://www.linkedin.com/company/govtech-singapore,,"Engineering, Information Technology",Information Technology & Services,2022-04-06T01:49:39.000Z,Full-time,https://www.linkedin.com/jobs/view/2944337158/,https://media-exp1.licdn.com/dms/image/C4D0BAQGT9Dy38Q2jdQ/company-logo_200_200/0/1519890805213?e=1655337600&v=beta&t=GlLnDaLmisjvCjn3Xn3G6A7Ri6vJdxmkibVcU_H-tIQ,2022-03-14T07:37:31.620Z,https://www.linkedin.com/jobs/view/2944337158/,
Technology Consulting – Cloud Architect,"South East Community Development Council, Singapore",8,64,,2022-03-13T07:57:07.000Z,false,https://krb-sjobs.brassring.com/TGnewUI/Search/home/HomeWithPreLoad?PageType=JobDetails&partnerid=26059&siteid=5096&jobId=532521&codes=Kyndryl_LinkedIn,"Why Kyndryl
Our world has never been more alive with opportunities and, at Kyndryl, we’re ready to seize them. We design, build, manage and modernize the mission-critical technology systems that the world depends on every day. Kyndryl is at the heart of progress — dedicated to helping companies and people grow strong. Our people are actively discovering, co-creating, and strengthening. We push ourselves and each other to seek better, to go further, and we carry this energy to our customers. At Kyndryl, we want you to keep growing, and we’ll provide plenty of opportunities to make that happen.

Please be aware that we have the Kyndryl candidate zone hosted by IBM for a certain period. If you have applied for an IBM role previously, you will be able to log into the candidate zone using your previous IBM log in details. When in the candidate zone, you will be able to see your previous applications for both IBM and Kyndryl.

For further information on privacy, please visit www.kyndryl.com/privacy.

Your Role And Responsibilities
Technology Consulting advises our clients in transformation and optimization of their journeys to cloud. As a Cloud Architect, you accompany our customers across Middle East and Africa region with a lot of positive energy from strategic consideration to successful implementation.

We are seeking a Cloud Architect who can develop a company's cloud strategy. This strategy incorporates cloud adoption plans, cloud application design as well as cloud management and monitoring.

This role is responsible for designing and developing advanced cloud-based solutions for organizations migrating and modernizing their existing workloads and infrastructure to the cloud. The Architect assists with cloud deployment models such as the public cloud, private cloud, and hybrid cloud.

Your Tasks
 As a cloud architect you will be responsible for designing and implementing infrastructures in hybrid multi cloud environments.  You can connect the dots between different technology domains and business, and you can advise client architects to become a trusted partner.  Analyze existing infrastructures, define strategies, design solutions, and develop high level/low level architectures.  You demonstrate knowledge of cloud architecture and implementation features (OS, multi-tenancy, virtualization, orchestration, elastic scalability)  Demonstrate knowledge of DevOps tool chains and processes  Act as a Subject Matter Expert to the customers for cloud end-to-end architecture  Develop a library of deployable and documented cloud design patterns  Develop solutions architecture and evaluate architectural alternatives for private, public and hybrid cloud models, including IaaS, PaaS, and other cloud services for large scale hybrid multi cloud environments using public and private cloud technologies such as AWS, Azure, GCP, VMWare, OpenStack.  Contribute to DevOps development activities and complex development tasks  Define optimal design patterns and solutions for high availability and disaster recovery for applications.  You understand whole solution architecture concepts and communicate and negotiate designs with customer architects.  You can facilitate workshops, present to client’s audiences and Executive-Level.  You drive scope definition, requirements analysis, functional and technical design, application build, product configuration, unit testing, and production deployment.  Ensure delivered solutions meet/perform to technical and functional/non-functional requirements  Agile work is natural for you  You are actively involved in our professional internal communities 

You can expect
 A global network of experts working on the future of the Cognitive Enterprise  A tailor-made entry that takes into account your personal interests and strengths  Personal career development in a global company that adapts to your life planning  Flexible working models  Mentoring and targeted training in new topics  An environment in which growth and new ideas are desired 

Required Technical And Professional Expertise
 Completed degree in a business, natural science or technical degree program  Professional experience: at least 10+ years of work experience, with 5+ years of relevant experience as cloud architect, cloud advisor, cloud consultant or equivalent.  Ability to design and implement cloud infrastructure, platforms and applications  Certification as Cloud Solution Architect by AWS, Azure or GCP will be preferred.  Extensive Experience with modern tools & concepts for cloud Service Management, Automation and Operations, etc. Github, Gitlab, Bamboo, Jenkins, travis, JSON, YAML, Python, Java, C#  Strong knowledge in large scale Enterprise Architecture across end to end process including infrastructure components, applications, implementation delivery, service management and support lifecycle.  Strong Architecture & Solutioning skills and hands on experience leveraging cloud technologies including public cloud (AWS, Azure, GCP, .) and private cloud (VMWare, OpenStack, OpenShift etc.)  Knowledge with container adoption strategies, approach and Agile DevOps methodologies is a big plus.  Excellent leadership & consulting skills  Excellent written and verbal communication  Ability to translate business requirements into technology solutions.  Ability to translate visions into executable projects with clarity and purpose  Excellent analytical, organizational, problem solving, collaboration and communication skills 

Preferred Technical And Professional Experience
As indicated above.

Required Education
Bachelor's Degree

Preferred Education
Master's Degree

Country/Region
Singapore

State / Province
SOUTH EAST

City / Township / Village
Singapore

Being You @ Kyndryl
Kyndryl is committed to creating a diverse environment and is proud to be an equal opportunity employer. All qualified applicants will receive consideration for employment without regard to race, color, religion, gender, gender identity or expression, sexual orientation, national origin, genetics, pregnancy, disability, age, veteran status, or other characteristics. Kyndryl is also committed to compliance with all fair employment practices regarding citizenship and immigration status.

Other Things To Know
For additional information about location requirements, please discuss with the recruiter following submission of your application.

Primary Job Category
Architect

Role ( Job Role )
Infrastructure Architect

Employment Type
Full-Time

Contract type
Regular

Position Type
Professional

Travel Required
No Travel

Company
(Y060) Kyndryl (Singapore) Pte. Ltd.

Is this role a commissionable/sales incentive based position?
No",false,Kyndryl,https://www.linkedin.com/company/kyndryl,,"Engineering, Information Technology",Information Technology & Services,2022-04-12T07:57:06.000Z,Full-time,https://www.linkedin.com/jobs/view/2953629200/,https://media-exp1.licdn.com/dms/image/C560BAQHgQ1kcTnuSCg/company-logo_200_200/0/1624663575900?e=1655337600&v=beta&t=_cKdn4OQlv0-rJDaOJvXY36PTEpESzb3-z6cTvcKn_w,2022-03-14T07:37:34.570Z,https://www.linkedin.com/jobs/view/2953629200/,
