jobTitle,jobLocation,applicantsCount,viewsCount,jobPosterProfileUrl,postedAt,appliesClosed,applyUrl,jobDescription,remoteAllowed,companyName,companyUrl,matchedSkills,jobFunctions,jobIndustries,appliesClosedAt,jobType,jobUrl,jobImageUrl,timestamp,query,error
"Senior Edge Specialist Solutions Architect, ASEAN","Singapore, Singapore",7,54,,2022-03-08T10:52:31.000Z,false,https://www.amazon.jobs/jobs/1971853/senior-edge-specialist-solutions-architect-asean?cmpid=SPLICX0248M&utm_source=linkedin.com&utm_campaign=cxro&utm_medium=social_media&utm_content=job_posting&ss=paid,"Job Summary

DESCRIPTION

Are you passionate about helping customers utilize the latest in secure, distributed computing and content acceleration technologies? Do you have the ability to put together unique cutting-edge solutions that bring together a global look at security and performance? Do you have a unique combination of deep technical knowledge, business acumen and strong interpersonal skills? Amazon Web Services (AWS) is seeking an Edge Services Solutions Architect to work with our customers to craft cloud-based solutions.

At AWS, customer obsession is in our DNA. The successful candidate will become a trusted adviser to our customers and will work with AWS sales, business development, and our edge services team to drive edge-services-related adoption and revenue. This will include showcasing services such as Amazon CloudFront (CDN), AWS Global Accelerator, AWS Shield (DDoS Mitigation), AWS WAF (Web Application Firewall), and more.

Your broad responsibilities include: owning the technical engagement and ultimate success around specific implementation projects. You should be as comfortable discussing complex technical details with a room full of engineers as you are briefing an executive audience. In addition, you will engage with other AWS service teams, solutions architects, partner and professional services organizations to drive large and highly complex sales opportunities to closure.

Here Are Some Other Qualities We Are Looking For

Be great fun to work with. At AWS, we have a credo of “Work hard. Have fun. Make history”. In this role, you will love what you do, and instinctively know how to make work fun. You will be dynamic and creative, and willing to take on any challenge and make a big impact.

Enjoy working with customers of all shapes and sizes. You will have a passion for educating, training, designing, and building cloud solutions for a diverse and challenging set of customers ranging from small businesses to the largest enterprises.

Responsibilities
 Ensure customer success in building and launching edge-services-related solutions on the AWS platform Educate customers of all sizes on the value proposition of AWS, and participate in deep architectural discussions to ensure solutions are designed for successful deployment in the cloud Conduct one-to-few and one-to-many training sessions to transfer knowledge to customers considering or already using AWS Capture and share best-practice knowledge amongst the AWS solutions architect community Author or otherwise contribute to AWS customer-facing publications such as white papers Build deep relationships with senior technical individuals within customers to enable them to be cloud advocates Act as a technical liaison between customers, service engineering teams and support

Basic Qualifications
 5+ years of experience in application or server architecture and networking Experience working with external or internal customers to implement large-scale solutions Technical degree required; Computer Science or Math background highly desired Demonstrated ability to adapt to new technologies and learn quickly
Preferred Qualifications
 Understanding of CDN technologies and communications protocols Presentation skills with a high degree of comfort with both large and small audiences High level of comfort communicating effectively across internal and external organizations Demonstrated ability to adapt to new technologies and learn quickly Experience developing edge-services solutions and passion for getting hands dirty with code (e.g, Node.js) Intermediate/advanced knowledge of the AWS services, market segments, customer base and industry verticals Prior experience in a technical role within a sales organization Understanding of application, server, and network security and compliance requirements such as PCI, FedRAMP and HIPAA Demonstrated experience leading or developing high quality, enterprise scale software products using a structured system development lifecycle Knowledge and experience with perimeter security.
What if I’m not an expert in all the above? That’s okay. We hire people who have a passion for learning, and are curious to build, learn and grow. You will be supported in your career development here at AWS. You will have plenty of opportunities to build your technical, leadership, business and consulting skills. This will include formal and on the job training, and a chance to learn and upskill through AWS certification courses and mentorship. You will learn from and collaborate with some of the brightest technical minds in the industry today. If you want to work with the best cloud technologies from the world’s leading cloud provider, apply now. We can’t wait to see what you build here. Come build the future with AWS.

CULTURE AND COMMITMENT TO INCLUSION, DIVERSITY & EQUITY

At AWS, we welcome all builders. We believe that technology should be built in a way that’s inclusive, accessible, and equitable. We’re committed to putting in the work for more equal representation.

Amazon is committed to a diverse and inclusive workplace. Amazon is an equal opportunity employer, and does not discriminate on the basis of race, national origin, gender, gender identity, sexual orientation, disability, age, or other legally protected status.

Amazon is an equal opportunity employer, and does not discriminate on the basis of race, national origin, gender, gender identity, sexual orientation, disability, age, or other legally protected status.


Company - Amazon Web Services Singapore

Job ID: A1971853",false,Amazon Web Services (AWS),https://www.linkedin.com/company/amazon-web-services,,"Consulting, Information Technology, Engineering","Computer Software, Information Technology & Services, Internet",2022-04-07T10:52:29.000Z,Full-time,https://www.linkedin.com/jobs/view/2959245036/,https://media-exp1.licdn.com/dms/image/C560BAQE_4UwvNNtNTQ/company-logo_200_200/0/1640205885683?e=1655337600&v=beta&t=MlDDChzrnrPCvlJTpz7hJgbAMGTzo2IhQ8UihPeCacE,2022-03-14T10:48:15.699Z,https://www.linkedin.com/jobs/view/2959245036/,
Technical Support Engineer - APAC (Mandarin Speaking) - MessageBird (SparkPost),"Singapore, Singapore",4,101,,2022-03-03T14:13:07.000Z,false,https://www.messagebird.com/en/careers-job/?gh_jid=5955734002&gh_src=53b636252,"Transform the communications world! 

We’re proud (and excited!) to be transforming the global communications landscape through our Omnichannel Platform-as-a-Service (OPaaS).

What’s my job title? Technical Support Engineer - APACWhere in the world? You can work remotely from Singapore.Working hours? For this role, you will operate within the Singapore timezone.What language(s) are required? Fluency in English and Mandarin.

Our Amazing #TeamSparkpost 

SparkPost is the industry’s most trusted email optimization platform. SparkPost helps senders reliably reach the inbox with powerful solutions to help them plan, execute and optimize their email programs. The SparkPost platform is powered by the industry’s largest data network, a team of email experts to help brands elevate every aspect of their email program, and a security and compliance posture to support even the most regulated industries. SparkPost is the world’s largest sender, delivering 40% of all commercial email - 4-5 trillion sent annually - and also boasts the world’s largest data footprint to help enterprise-level brands make data-driven decisions to improve their email performance. The world’s most sophisticated senders, including The New York Times, Zillow, Adobe and Booking.com trust SparkPost to elevate their email.

What You’ll Do in This Role to Add Value 

Technical Support Engineers provide technical guidance to customers on complex use cases across our many products including our on-prem MTA software, the SparkPost cloud sending platform, deliverability analytics, and email design/templating capabilities. Examples of support activities include:

Troubleshooting errors on REST API callsAnswering technical questions on processing data batches from webhooksTeaching customers how to understand and make use of raw data and aggregated metricsProviding guidance on the use of our templating featuresDiagnosing DNS issuesAnswering questions on email authentication concepts like DKIM, SPF and DMARCInstalling and upgrading our MTA software products
Verifying proper hardware and software set upAssisting with setup and configuration of softwareDiagnosing and fixing software configuration issues

Responsibilities

Provide exceptional customer service to our customers by giving accurate and helpful guidance while demonstrating our company valuesShow empathy and professionalism in all customer interactionsManage and work from a prioritized queue of customer inquiriesWork closely with Engineering team to escalate urgent customer issuesLiaise with Product teams to collaborate on features by providing a thorough understanding of the use casesSupport the Sales team to help troubleshoot and resolve issues and questions from prospective customers Participate in on-call rotation for high priority issuesAssist in documentation – create knowledge-base articles, FAQs and how-to guides for our customersTechnical aptitude to keep up to date with our constantly changing productsAdvise customers running our MTA software in production environments by providing discrete technical guidance on installation, configuration and architecture

Required Skills/Qualifications

Bachelor’s degree or equivalent (preferably in an IT field or related experience)Fluency in both English and Mandarin (business proficiency)Previous experience support experience with a SaaS provider is highly desiredHands on experience using or supporting REST APIsTechnical SkillsSoft Skills

Desired Skills/Experience

Experience working with SparkPost/Momentum/PowerMTA or other MTA technologies like PostfixFamiliarity with email deliverability concepts like IP warm up and suppression listsKnowledge of SMTP and email delivery and authentication concepts

Sparkpost provides equal employment opportunities to all employees and applicants for employment and prohibits discrimination and harassment of any type without regard to race, color, religion, age, sex, national origin, disability status, genetics, protected veteran status, sexual orientation, gender identity or expression, or any other characteristic protected by federal, state or local laws. 

This policy applies to all terms and conditions of employment, including recruiting, hiring, placement, promotion, termination, layoff, recall, transfer, leaves of absence, compensation and training.

What You’ll Gain

Work from anywhere Generous stock options for all BirdsWFH set-up budgetState-of-the-art work gearLearn from hundreds of the best minds in the businessCollaborate with diverse colleagues from over 55 countries (and counting)

LIFTOFF! 🚀

Life at MessageBird:

We call ourselves Birds!

We work fast, grow fast, build fast and focus on impact. We’re go-getters, industry leaders and roll-up-your-sleeves-and-make-it-happen kind of people.

Ready To Fly?

Our cloud communications solutions make it possible for over 25,000 businesses to instantly connect with billions of devices worldwide, allowing them to speak with their customers in the same ways they talk to their friends.

Headquartered in Amsterdam, we’re proud to be a “Work Anywhere” company. Our unique and united culture is rooted in our team: a diverse flock of over 750 Birds who represent 55 nationalities and counting. We’re smart, fast, and hungry. Our potential for growth is limitless. You can learn more about our story and life as a Bird via https://www.linkedin.com/company/messagebird-com/life/welcome/

We understand that “life happens” and give you the freedom to choose the best environment for you to “get sh*t done”. Our Birds choose where they work from in the region or country we’re hiring in, so long as it’s within the job’s complementary timezone as indicated in the Job descriptions — this could be from one of our MessageBird hubs (Amsterdam, Singapore or Bogota) or remotely.... Want to work from a rural retreat? Sure, no problem! How about a bustling city getaway for a few weeks? Go ahead!

MessageBird is committed to fostering a fair and equal environment based on trust and mutual respect. We believe that a diverse and inclusive workplace is paramount to our success and we are committed to building a team that represents a wide variety of backgrounds, perspectives, and skills.

Recruitment Privacy Statement:

https://messagebird.com/download/pdf/MB-recruitment-privacy-notice%202020.pdf

",true,MessageBird,https://www.linkedin.com/company/messagebird-com,,Information Technology,Telecommunications,2022-04-02T14:13:06.000Z,Full-time,https://www.linkedin.com/jobs/view/2945543291/,https://media-exp1.licdn.com/dms/image/C560BAQEAOrYJ6eTmRg/company-logo_200_200/0/1638978972028?e=1655337600&v=beta&t=BgUB_BM1Uf2KQOGGcl3h0Bq6U4wFnZRq7-VCokpw7gc,2022-03-14T10:48:19.652Z,https://www.linkedin.com/jobs/view/2945543291/,
Service Reliability Engineer,"Singapore, Singapore",4,54,,2022-03-08T19:52:20.000Z,false,https://datarobot.wd1.myworkdayjobs.com/DataRobot_External_Careers/job/Remote-India/Software-Engineer_R-100996?gh_src=1dc742401&source=Linkedin,"Job Description:

The DataRobot AI Cloud Platform provides mission critical services for our customers. We are expanding our Service Reliability Engineering team as we build the next generation of DataRobot. We are looking for individuals who are excited to have the opportunity to work on high impact cloud platforms, thrive in troubleshooting and solving complex problems, and enjoy enhancing reliability through automation and tooling.

Service Reliability Engineers (SRE) troubleshoot, debug, evaluate and resolve alarms, perform systems management, perform software deployments and migrations, and automate routine operational tasks with the end result being a more stable, reliable, and available environment for DataRobot customers. SREs play a key role in designing and modifying DataRobot tools and practices to provide observability and seamless scaling while proactively preventing failures.

As an SRE at DataRobot, you will leverage your technical analysis, problem solving, excellence in communication, and attention to detail to methodically resolve issues when they occur. Technically, you will understand the full stack of the services you support (Network to Application) and are able to dig deep into services to determine how to best mitigate customer impact. Further, you will drive improvements through the development of tools and engage partner teams to drive down incident counts, reduce severity of events, and minimize time to mitigate. You will help create a “Site Up” culture across all DataRobot teams.

As a member of the DataRobot Service Reliability team, you will be surrounded by individuals representing some of the brightest and most innovative minds in the industry. You will be a part of an organization that prides itself on providing training, empowerment, and career progression. Bring your passion for collaboration and automating everything and help enable the next generation of AI.

Responsibilities: 

Must be familiar with a standard cloud architecture patterns and capabilities (AWS / GCP / Azure)Handle high-pressure situations in a calm and professional mannerLead resolution effort of complex service problems from the network layer to the application at scale Motivate, encourage, and provide technical leadership to team members Work hand-in-hand with software developers to facilitate the adoption of ""Paved Road"" solutions and DevSecOps toolchainReview technical specifications to provide guidance and help development teams drive operational excellenceSupport large-scale services across multiple environmentsDiagnose and repair issues by editing code in python, modifying configuration of supporting infrastructure such as MongoDB, Postgres, Redis, RabbitMQ, or programmatically modifying cloud-hosted resources Create, edit, and maintain ad hoc scripts to resolve issues quickly with minimal user impact Contribute to the development of new tools and automation that ensures the service can be optimized and tuned with minimal human intervention Participate in follow the sun on-call rotation

Technologies: 

Linux/UNIX (Ubuntu, RedHat, or similar)Experience with Kubernetes on multiple cloud provider platformsTerraform or CloudFormationAnsibleMongoDB, RabbitMQ, Postgres, RedisELK, Clickhouse, Grafana, etc. AWS or strong experience in GCP or AzureDemonstrable experience in one or more languages: Python, Bash Strong knowledge of TCP/IP networking, SMTP, HTTP, DNS, load-balancersExperience performing network and performance analysis, and investigating application/network issues using tools like netcat, fiddler and Wireshark GitHub / ArtifactoryApplication Performance Monitoring principles

Qualifications:

Bachelor's Degree in CS, MIS, or equivalent experience; 1-2 years of relevant experience with Linux/Unix systems fundamentals, monitoring, cloud services, networking, storage, database, and application knowledge;Solid communications skills 

Our Core Values:

Be You - We are co-contributors to our culture committed to diversity, inclusion, equity and a sense of belonging throughout our global community. We value each person as their authentic self and welcome honest and respectful dialogue as an avenue to greatness.Dream Big - We don’t settle for the status quo. We always pursue the development of the next version of ourselves. We believe investment in the growth and resilience of our people is the foundation of building an iconic company.Be Data-Driven - We believe data-driven decision making enables innovation and execution at velocity while ensuring repeatable success. We take on the toughest challenges as we transform the world with our platform and AI.Better Together - We celebrate success and learn from failure as one team. We foster an aligned, collaboration-first workplace by building trust through transparency, integrity and accountability.Champion Customers - We empower our customers and our communities by shaping the future of trusted, augmented intelligence in order to solve their most difficult problems. We are humble, not complacent. We succeed when they succeed.

All U.S. DataRobot employees must be fully vaccinated against COVID-19. If there is a medical, religious, or other legally protected reason that prevents you from receiving an available COVID-19 vaccination, and you are selected as a candidate for consideration, we have a process in place to evaluate requests for accommodation.

DataRobot is proud to be an Equal Employment Opportunity and Affirmative Action employer. We do not discriminate based upon race, religion, color, national origin, gender (including pregnancy, childbirth, or related medical conditions), sexual orientation, gender identity, gender expression, age, status as a protected veteran, status as an individual with a disability, or other applicable legally protected characteristics. DataRobot is committed to working with and providing reasonable accommodations to applicants with physical and mental disabilities. Please see the United States Department of Labor’s EEO poster and EEO poster supplement for additional information.

All applicant data submitted is handled in accordance with our Applicant Privacy Policy.",true,DataRobot,https://www.linkedin.com/company/datarobot,,"Engineering, Information Technology",Information Technology & Services,2022-04-07T19:52:19.000Z,Full-time,https://www.linkedin.com/jobs/view/2959792330/,https://media-exp1.licdn.com/dms/image/C4E0BAQEtsG-F4Xmbvg/company-logo_200_200/0/1646364107067?e=1655337600&v=beta&t=Ox5RFg5ezHTpEsV6spH9ShBt2we6c6oFBFsXqJGCNB8,2022-03-14T10:48:23.535Z,https://www.linkedin.com/jobs/view/2959792330/,
