jobTitle,jobLocation,applicantsCount,viewsCount,jobPosterProfileUrl,postedAt,appliesClosed,applyUrl,jobDescription,remoteAllowed,companyName,companyUrl,matchedSkills,jobFunctions,jobIndustries,appliesClosedAt,jobType,jobUrl,jobImageUrl,timestamp,query,error
Emerging Solutions Intern,"Singapore, Singapore",3,115,,2022-03-07T08:02:08.000Z,false,https://illumina.wd1.myworkdayjobs.com/illumina-careers/job/Singapore---Woodlands/Emerging-Solutions-Intern_31423-JOB-1/apply?source=LNKD,"The Emerging Solutions Intern will complete an 18-24 week program from Jun to Dec 2022. Selected candidates will be invited to submit a video interview, and top candidates will be invited to our office to attend an assessment event. Offers will be extended following the event.

Project Description

The cost to sequence a human genome is rapidly decreasing and will approach $100 in the coming years. This is driving the creation of multi-omic data sets, population sequencing of multi-million sample human cohorts, gene expression profiles of millions of cells from a single sample, experiments to characterize the functional consequences of all possible variants in a gene, and surveys of the complete human immune repertoire… and this is just the beginning.

To derive value and insights from these incredibly deep and varied data sets, genomics has become an information science, requiring investment in modern data engineering, data science, and machine learning capabilities. Applications range from personalized health care to genetics-informed drug discovery.

Towards this end, Illumina is enabling the creation of extremely large clinical-genomic datasets and pioneering the application of novel analytical methods, including artificial intelligence, to this data.

The successful candidates will play a key role in advancing this vision, working across internal teams and with external partners to identify and develop new capabilities, while also contributing directly with focused analytic and engineering work.

Roles And Responsibilities
Work collaboratively with teammates, other teams within Illumina, and with external collaborators and partners to apply novel genomic data sets and tools to personalized medicine, drug development, and other emerging applications.Contribute to the development and implementation of our tools to better allow the use of large genomic data sets in these emerging applications.Work with Illumina software engineering colleagues to deploy these techniques to internal and external users on a cloud-deployed platform.Contribute to pilot studies with partnersCommunicate effectively across the research and informatics organizationsLearn and have fun!
Qualifications And Requirements
Must be currently enrolled in an undergraduate program, ideally in Computational Biology, Biomedical Engineering, Computer Science, Biomedical Science or EngineeringCompetent in at least one software programming language, preferably Python (or R) for data analysis and visualizationPassion for technology, healthcare, and personalized medicineExcellent interpersonal and communication (English – both oral and written) skills, along with the ability to communicate appropriately and confidently with colleagues from a wide range of backgrounds and seniority levelsExcellent analytical and problem-solving skillsSelf-motivated, resourceful and proactiveCurious and observative, in order to rapidly comprehend the research and development environment to deliver fit for purpose results to the project teamExperience with database technologies (SQL & no-SQL) and ETL from varied data sources is preferred
Learning Objectives

This internship opportunity aims to provide students whose interests lie beyond academic research with practical experience of how they can apply the knowledge they have acquired in alternate roles.

The goals are to help the student achieve the following learning objectives:
Real-life experience in prototyping and developing new data science and software solutions in an emerging space in personalized medicine and drug development.Hands on project experience analysing and reporting computational results to research project teams Develop strong interpersonal and communication skills
Concerns regarding COVID-19 continue as positive cases are experienced in the communities in which we operate. Please be aware that, as a condition of employment, Illumina may require proof of COVID vaccination in accordance with local statutory requirements (subject to limited exceptions) beginning November 1, 2021.

Illumina believes that everyone has the ability to make an impact, and we are proud to be an equal opportunity employer committed to providing employment opportunity regardless of sex, race, creed, color, gender, religion, marital status, domestic partner status, age, national origin or ancestry, physical or mental disability, medical condition, sexual orientation, pregnancy, military or veteran status, citizenship status, and genetic information.",false,Illumina,https://www.linkedin.com/company/illumina,,"Sales, Business Development","Biotechnology, Research, Medical Device",2022-04-06T08:02:07.000Z,Full-time,https://www.linkedin.com/jobs/view/2944375125/,https://media-exp1.licdn.com/dms/image/C4E0BAQFkC6fIWzdLuw/company-logo_200_200/0/1594056806268?e=1655337600&v=beta&t=nkvWB8Gd5b21agA4DJzTIooeowvzmobIC_VodfaSgNU,2022-03-14T04:07:00.835Z,https://www.linkedin.com/jobs/view/2944375125/,
Emerging Solutions Intern,"Singapore, Singapore",7,105,,2022-03-07T08:02:08.000Z,false,https://illumina.wd1.myworkdayjobs.com/illumina-careers/job/Singapore---Woodlands/Emerging-Solutions-Intern_31422-JOB/apply?source=LNKD,"The Emerging Solutions Intern will complete an 18-24 week program from Jun to Dec 2022. Selected candidates will be invited to submit a video interview, and top candidates will be invited to our office to attend an assessment event. Offers will be extended following the event.

Project Description

The cost to sequence a human genome is rapidly decreasing and will approach $100 in the coming years. This is driving the creation of multi-omic data sets, population sequencing of multi-million sample human cohorts, gene expression profiles of millions of cells from a single sample, experiments to characterize the functional consequences of all possible variants in a gene, and surveys of the complete human immune repertoire… and this is just the beginning.

To derive value and insights from these incredibly deep and varied data sets, genomics has become an information science, requiring investment in modern data engineering, data science, and machine learning capabilities. Applications range from personalized health care to genetics-informed drug discovery.

Towards this end, Illumina is enabling the creation of extremely large clinical-genomic datasets and pioneering the application of novel analytical methods, including artificial intelligence, to this data.

The successful candidates will play a key role in advancing this vision, working across internal teams and with external partners to identify and develop new capabilities, while also contributing directly with focused analytic and engineering work.

Roles And Responsibilities
Work collaboratively with teammates, other teams within Illumina, and with external collaborators and partners to apply novel genomic data sets and tools to personalized medicine, drug development, and other emerging applications.Contribute to the development and implementation of our tools to better allow the use of large genomic data sets in these emerging applications.Work with Illumina software engineering colleagues to deploy these techniques to internal and external users on a cloud-deployed platform.Contribute to pilot studies with partnersCommunicate effectively across the research and informatics organizationsLearn and have fun!
Qualifications And Requirements
Must be currently enrolled in an undergraduate program, ideally in Computational Biology, Biomedical Engineering, Computer Science, Biomedical Science or EngineeringCompetent in at least one software programming language, preferably Python (or R) for data analysis and visualizationPassion for technology, healthcare, and personalized medicineExcellent interpersonal and communication (English – both oral and written) skills, along with the ability to communicate appropriately and confidently with colleagues from a wide range of backgrounds and seniority levelsExcellent analytical and problem-solving skillsSelf-motivated, resourceful and proactiveCurious and observative, in order to rapidly comprehend the research and development environment to deliver fit for purpose results to the project teamExperience with database technologies (SQL & no-SQL) and ETL from varied data sources is preferred
Learning Objectives

This internship opportunity aims to provide students whose interests lie beyond academic research with practical experience of how they can apply the knowledge they have acquired in alternate roles.

The goals are to help the student achieve the following learning objectives:
Real-life experience in prototyping and developing new data science and software solutions in an emerging space in personalized medicine and drug development.Hands on project experience analysing and reporting computational results to research project teams Develop strong interpersonal and communication skills
Concerns regarding COVID-19 continue as positive cases are experienced in the communities in which we operate. Please be aware that, as a condition of employment, Illumina may require proof of COVID vaccination in accordance with local statutory requirements (subject to limited exceptions) beginning November 1, 2021.

Illumina believes that everyone has the ability to make an impact, and we are proud to be an equal opportunity employer committed to providing employment opportunity regardless of sex, race, creed, color, gender, religion, marital status, domestic partner status, age, national origin or ancestry, physical or mental disability, medical condition, sexual orientation, pregnancy, military or veteran status, citizenship status, and genetic information.",false,Illumina,https://www.linkedin.com/company/illumina,,"Sales, Business Development","Biotechnology, Research, Medical Device",2022-04-06T08:02:07.000Z,Full-time,https://www.linkedin.com/jobs/view/2944374146/,https://media-exp1.licdn.com/dms/image/C4E0BAQFkC6fIWzdLuw/company-logo_200_200/0/1594056806268?e=1655337600&v=beta&t=nkvWB8Gd5b21agA4DJzTIooeowvzmobIC_VodfaSgNU,2022-03-14T04:07:04.501Z,https://www.linkedin.com/jobs/view/2944374146/,
"Software Engineer (Computing Engine), Cloud Infrastructure","Singapore, Singapore",6,92,https://www.linkedin.com/in/ACoAACBJyQMBG7vI0ZwiXv4EKEEq0-NYLg2fTV0,2022-03-06T10:01:02.000Z,false,https://careers.tiktok.com/position/7059235327776655624/detail,"About TikTokTikTok is the leading destination for short-form mobile video. Our mission is to inspire creativity and bring joy. TikTok has global offices including Los Angeles, New York, London, Paris, Berlin, Dubai, Singapore, Jakarta, Seoul and Tokyo.
Team IntroductionThe Cloud Infrastructure team, based in Singapore, supports many of our star products and core business lines, serving hundreds of millions of users every day. We actively embrace open source and innovative software/hardware architecture, building a series of infrastructure to ensure the best R&D practices and enable the overall development of the company.
The big data Computing Engine team is responsible for TikTok and its affiliates' offline computing, streaming computing and real-time computing engine. We support many core businesses and teams such as AML, recommendation, warehouse, search, advertising, streaming media, as well as security and risk control.
Offline computing is mainly based on Spark, with the average number of daily tasks reaching hundreds of thousands of instances, covering ETL, offline data processing, adhoc queries and other scenarios. We support all our internal recommendation / advertising / search and other large-scale data processing of a large number of core businesses.
Streaming computing is mainly based on Flink, with the total number of tasks reaching as high as tens of thousands, covering multiple business scenarios such as ETL, real-time monitoring, real-time features, etc. We also support the construction of our internal real-time data warehouse and streaming-batch integration business scenarios.
The real-time compute engine is based on self-research, covering real-time warehouse, real-time online services, high-frequency updates , online feature store and other machine learning scenarios. We also support a series of internal advertising, live broadcasts, recommendation, and other scenes that require data processing and real-time online services.
What you will be doing:R&D for an efficient, real-time and reliable distributed computing engine;R&D for our distributed computing platform and machine learning training job scheduling system. Optimize its stability, performance and other aspects;Achieve an in-depth understanding of our business model and ideate abstract solutions to solve business problems.
What you should have:Proficient in Java/Python/C++ and other programming languages and common algorithms, with large-scale distributed system R&D and optimization capabilities;In-depth research and relevant experience in the open source computing framework (Hadoop MapReduce/Spark/Flink is preferred);In-depth research and related experience in the cluster resource management system (Hadoop Yarn/Mesos/Kubernetes is preferred).
Preferred QualificationsIn-depth research and experience in machine learning training and scheduling framework;Experience in ultra-large scale cluster operation and management.",false,TikTok,https://www.linkedin.com/company/tiktok,,"Engineering, Information Technology",Entertainment,2022-04-05T10:01:01.000Z,Full-time,https://www.linkedin.com/jobs/view/2942981544/,https://media-exp1.licdn.com/dms/image/C510BAQGCdThXIss7UQ/company-logo_200_200/0/1539940587971?e=1655337600&v=beta&t=fxKtBCnmKKYwlrgKn0lQ26W4vjNFf3aP1SwTxY_drXU,2022-03-14T04:07:08.675Z,https://www.linkedin.com/jobs/view/2942981544/,
"Customer Engineer, Small/Medium Businesses, Google Cloud (Korean)","Singapore, Singapore",14,324,,2022-02-26T00:23:34.000Z,false,https://careers.google.com/jobs/results/95077872416236230-customer-engineer/?src=Online/LinkedIn/linkedin_us&utm_source=linkedin&utm_medium=jobposting&utm_campaign=contract,"Google will be prioritizing applicants who have a current right to work in Singapore, and do not require Google's sponsorship of a visa.

Minimum qualifications:
Bachelor's degree in Computer Science, a related technical field, or equivalent practical experience.Experience with cloud computing concepts such as Big Data, Platform-as-a-Service and Infrastructure-as-a-Service (PaaS and IaaS) technologies. Experience with presenting and delivering technical pitches.Ability to speak and write in Korean fluently to engage and support Korean-speaking customers to navigate industry standards.

Preferred qualifications:
Experience serving in the capacity of a technical sales engineer in a cloud computing environment or equivalent experience in a customer-facing role.Experience with compute infrastructure and networking concepts including: routing, VPNs, load balancers, and firewalls.Experience in and understanding of data and information management as it relates to big data trends and business challenges. Experience using and/or managing databases.Ability to quickly learn, understand, and work with new emerging technologies, methodologies, and solutions in the Cloud/IT technology space.

About The Job

The Google Cloud Platform team helps customers transform and build what's next for their business — all with technology built in the cloud. Our products are engineered for security, reliability and scalability, running the full stack from infrastructure to applications to devices and hardware. Our teams are dedicated to helping our customers — developers, small and large businesses, educational institutions and government agencies — see the benefits of our technology come to life. As part of an entrepreneurial team in this rapidly growing business, you will play a key role in understanding the needs of our customers and help shape the future of businesses of all sizes use technology to connect with customers, employees and partners.

As a Customer Engineer, you'll help shape and execute technical business strategies, acting as a trusted advisor to our clients and helping them to realize maximum business value from Google Cloud. You'll assist the Sales team by problem-solving key technical issues for our customers, while also liaising with the product marketing management and engineering teams to stay up-to-date on industry trends and to devise enhancements to Google Cloud products.

Google Cloud accelerates organizations’ ability to digitally transform their business with the best infrastructure, platform, industry solutions and expertise. We deliver enterprise-grade solutions that leverage Google’s cutting-edge technology – all on the cleanest cloud in the industry. Customers in more than 200 countries and territories turn to Google Cloud as their trusted partner to enable growth and solve their most critical business problems.

Responsibilities

Work with account executives to explore opportunities from the technical perspective, and collaboratively set the opportunity pursuit strategy. Develop the strategy to resolve technical impediments and scoping out migration workloads.Take responsibility for technical aspects of solutions to include such activities as managing product and solution briefings, proof-of-concept work, and the coordination of supporting technical resources.Work with Google Cloud products to demonstrate and prototype integrations in customer/partner environments.Prepare and deliver product messaging in an effort to highlight Google Cloud value proposition using techniques to include whiteboard and slide presentations, product demonstrations, white papers, trial management, and documents.Translate technical concepts to non-technical and executive Korean-speaking audiences. Utilize Korean language skill to help support customers for that market directly.

Google is proud to be an equal opportunity workplace and is an affirmative action employer. We are committed to equal employment opportunity regardless of race, color, ancestry, religion, sex, national origin, sexual orientation, age, citizenship, marital status, disability, gender identity or Veteran status. We also consider qualified applicants regardless of criminal histories, consistent with legal requirements. See also Google's EEO Policy and EEO is the Law. If you have a disability or special need that requires accommodation, please let us know by completing our Accommodations for Applicants form .",true,Google,https://www.linkedin.com/company/google,,Other,"Information Services, Internet",2022-03-28T00:23:33.000Z,Full-time,https://www.linkedin.com/jobs/view/2931030666/,https://media-exp1.licdn.com/dms/image/C4D0BAQHiNSL4Or29cg/company-logo_200_200/0/1519856215226?e=1655337600&v=beta&t=GMJuIzcHetlO1s-W5krxB3_GUon47tx0kNZX6eqNGR0,2022-03-14T04:07:11.918Z,https://www.linkedin.com/jobs/view/2931030666/,
Senior Cloud & DevOps Consultant - AWS,"Singapore, Singapore",8,70,https://www.linkedin.com/in/ACoAAAAn5NoBmIU6qdrIMTj41kAwEJv3vG6XDfQ,2022-03-10T05:32:46.000Z,false,https://grnh.se/77ac13352?s=LinkedIn&source=LinkedIn,"Sourced ValuesIntegrity, Innovation, Service, Quality, Humility, Sustainability
What you’ll be responsible forWorking closely with technical leads and client teams to fully demonstrate the benefits of cloud technologyHelping to build & introduce clients to automated delivery pipelines (CI/CD)Defining and implementing cloud-based solutions in line with industry best practices and enterprise architecture guidelinesSupporting customers in troubleshooting issues in their test and/or production environments and identifying root cause and solutionsPresenting case studies and cloud solutions at meetups, conferences and technology events
What you will bring to the role7+ years of enterprise IT consulting experienceBachelor’s degree in Engineering, Information Technology, Computer Science or a related fieldExperience in large-scale, secure, and high availability solutions in the AWS Cloud environmentExperience in cloud deployment templating using offerings such as CloudFormation and/or TerraformAn understanding of public cloud security principals and experience adhering to compliance standardsProgramming/scripting experience with Python, Bash, Terraform, or otherExperience working with source code management using GitExperience working with configuration management technologies such as Puppet, Chef, and/or AnsibleExperience with CI/CD methodologies, processes, and tools, such as Jenkins, CodePipeline, CodeDeploy, or otherKnowledge of logging & event management tools such as Splunk, ELK or otherExperience in preparing and presenting technical material to a variety of audiences
Desirable SkillsExperience working in the financial services sectorDatabase experience with SQL Server, MySQL, PostgreSQL or otherExperience with network design, subnetting, and routingProfessional and/or Specialty level AWS certificationsExperience in working with microservices or serverless architectureExperience working with containers using Docker
About SourcedSourced is a rapidly growing global consultancy with offices in multiple regions. Founded in 2010, we provide consulting services to migrate enterprise clients to hyperscale cloud providers. We specialize in organisation-wide cloud transformation and DevOps enablement for a wide range of industries, including financial services, healthcare, aviation, media, and telecommunications. We work with some of the largest and most security-conscious organisations around the world to help them unlock innovation through cloud computing.
Why Sourced? Sourced offers huge growth opportunities in an innovative, collaborative and inclusive environment. We have regular team social events, individual career development plans, supportive management and team members, training budget to utilise every year, monthly educational workshops, global relocation packages, as well as a generous employee share option plan! We provide opportunities to work on challenging technology solutions, whilst encouraging and aiding the ongoing professional development of our team.
Sourced Group is an equal opportunity employer committed to creating a safe, diverse and inclusive environment. We encourage qualified applicants of all backgrounds including ethnicity, religion, disability status, gender identity, sexual orientation, family status, age, nationality, and education levels to apply. If you are contacted for an interview and require accommodation during the interviewing process, please let us know.",false,Sourced Group,https://www.linkedin.com/company/sourced-group,,"Engineering, Information Technology, Consulting","Information Technology & Services, Computer Software, Management Consulting",2022-04-09T05:32:45.000Z,Full-time,https://www.linkedin.com/jobs/view/2950809092/,https://media-exp1.licdn.com/dms/image/C560BAQHj7GTajtCIUg/company-logo_200_200/0/1620870539014?e=1655337600&v=beta&t=Jv8dKd5bxDczySwh_X91-5cfsJ8Q6NkqeFMRZrFgZPU,2022-03-14T04:07:15.426Z,https://www.linkedin.com/jobs/view/2950809092/,
