jobTitle,jobLocation,applicantsCount,viewsCount,jobPosterProfileUrl,postedAt,appliesClosed,applyUrl,jobDescription,remoteAllowed,companyName,companyUrl,matchedSkills,jobFunctions,jobIndustries,appliesClosedAt,jobType,jobUrl,jobImageUrl,timestamp,query,error
"Technical Support Engineer, Video Cloud","Singapore, Singapore",30,320,https://www.linkedin.com/in/ACoAADH-JWkBvog51K_UPH_pETVQJA8BiWCbrL4,2022-02-25T10:57:33.000Z,false,https://careers.tiktok.com/position/7057727500637833508/detail,"The Video Cloud department mainly provides quality assurance for all video services related to TikTok's video infrastructure. The main supported businesses include Douyin, Xigua, Toutiao, TikTok, Dali Education and other mainstream apps. Multimedia middle platform (Video Cloud) is one of the world's leading video platforms, providing media storage, transcoding and streaming services. We are committed to building the next generation video processing platform and the largest live broadcast network to provide an excellent experience for billions of users around the world.The role of solution engineer requires in-depth understanding of the video cloud business architecture, helping internal/external business parties to deepen product awareness, promote product optimization, and output the best solution in combination with product capabilities. As a technical expert, you will be working closely with the Product R & D team to promote continuous optimization of products, tools, and processes.
ResponsibilitiesResponsible for the design and development of video cloud based solutions;Responsible for collaborating with developers and solving the problems encountered by developers during integration with video cloud services as well as the quality issues in the production service process;Responsible for management of suppliers' demands, sorting out the issues in the integration with suppliers, promoting the development and optimization of technical specifications, and reducing service problems;Have overall awareness, help establish a Quality Service (QS) evaluation system, improve the efficiency of problem handling, and effectively promote the resolution of quality and efficiency problems in the research and development process;Organize structural learning points and consolidate developer handbook to form a common knowledge base for the solution team.
QualificationsBachelor’s degree or above in Computer Science or other related majors, with solid fundamental computer science knowledge, strong logical thinking and learning abilities, and understanding of software design patterns;Good professional accomplishment and self-drive, strong technical enthusiasm, able to continue learning and self-improvement;Having excellent data analytical skills, issue identification ability, with prior experience in full-chain data collation and data-related tools;Good knowledge of networking fundamentals and protocols (eg. TCP/IP, HTTP/HTTPS, etc.). Familiar with audio & video multimedia protocol, CDN distribution acceleration, RTC and other technologies is preferred;Experience in project management, video cloud related experience or enterprise integration experience is preferred;",false,TikTok,https://www.linkedin.com/company/tiktok,,"Engineering, Quality Assurance",Internet,2022-03-27T10:57:32.000Z,Full-time,https://www.linkedin.com/jobs/view/2930210056/,https://media-exp1.licdn.com/dms/image/C510BAQGCdThXIss7UQ/company-logo_200_200/0/1539940587971?e=1655337600&v=beta&t=fxKtBCnmKKYwlrgKn0lQ26W4vjNFf3aP1SwTxY_drXU,2022-03-15T06:23:41.673Z,https://www.linkedin.com/jobs/view/2930210056/,
"Security Sales Specialist, VirusTotal, Google Cloud","Singapore, Singapore",15,209,,2022-02-24T00:11:31.000Z,false,https://careers.google.com/jobs/results/102940483153470150-security-sales-specialist/?src=Online/LinkedIn/linkedin_us&utm_source=linkedin&utm_medium=jobposting&utm_campaign=contract,"Google will be prioritizing applicants who have a current right to work in Singapore, and do not require Google's sponsorship of a visa.

Minimum qualifications:
Bachelor's degree or equivalent practical experience.4 years of experience in a sales role in the enterprise software or cloud space.2 years of experience with clients in the enterprise cybersecurity or IT field.

Preferred qualifications:
Experience carrying and exceeding strategic business goals.Experience starting a territory from scratch, understanding the security partner ecosystem.Product and solution knowledge of market trends in cybersecurity and Cloud. Ability to prioritize, plan, and organize sales activity with attention to detail. Ability to build continuous relationships, selling to executives across security and IT business units; ensure customer success and adoption, leading to customer expansion. Excellent analytical, problem-solving, communication, presentation, and active listening skills.

About The Job

The Google Cloud Platform team helps customers transform and build what's next for their business — all with technology built in the cloud. Our products are engineered for security, reliability and scalability, running the full stack from infrastructure to applications to devices and hardware. Our teams are dedicated to helping our customers — developers, small and large businesses, educational institutions and government agencies — see the benefits of our technology come to life. As part of an entrepreneurial team in this rapidly growing business, you will play a key role in understanding the needs of our customers and help shape the future of businesses of all sizes use technology to connect with customers, employees and partners.

With VirusTotal, our goal is to make the internet a safer place through collaboration between members of the antivirus industry, researchers, and end users of all kinds. As a Security Sales Specialist, you will help us grow our VirusTotal cybersecurity business by building and expanding relationships with new and existing customers. You will work with customers to deliver true business value, demonstrate product functionality, and provide a comprehensive overview of key business use cases. You will lead day-to-day relationships with external customer stakeholders, leading with empathy, while identifying innovative ways to multiply your impact and the impact of the team as a whole.

Google Cloud helps millions of employees and organizations empower their employees, serve their customers, and build what’s next for their business — all with technology built in the cloud. Our products are engineered for security, reliability and scalability, running the full stack from infrastructure to applications to devices and hardware. And our teams are dedicated to helping our customers and developers see the benefits of our technology come to life.

Responsibilities

Construct and execute an effective territory development plan; promote Security products in your territory to new and existing Security customers, meet or exceed quarterly goals.Develop and drive pipeline, manage cycles, from lead generation to customer onboarding.Build and maintain relationships to influence long-term strategic direction; act as a trusted advisor to the account.Partner with Marketing, Customer Engineering, Customer Success, Channels and Product, and Engineering teams to understand the customer and provide excellent prospect and customer experience.Represent VirusTotal in regional forecasts and team meetings; serve as stakeholder to regional Cloud leads; report current, accurate, and timely forecasts and business performance in Salesforce and other tools.

Google is proud to be an equal opportunity workplace and is an affirmative action employer. We are committed to equal employment opportunity regardless of race, color, ancestry, religion, sex, national origin, sexual orientation, age, citizenship, marital status, disability, gender identity or Veteran status. We also consider qualified applicants regardless of criminal histories, consistent with legal requirements. See also Google's EEO Policy and EEO is the Law. If you have a disability or special need that requires accommodation, please let us know by completing our Accommodations for Applicants form .",true,Google,https://www.linkedin.com/company/google,,"Sales, Business Development","Information Services, Internet",2022-03-26T00:11:30.000Z,Full-time,https://www.linkedin.com/jobs/view/2927582884/,https://media-exp1.licdn.com/dms/image/C4D0BAQHiNSL4Or29cg/company-logo_200_200/0/1519856215226?e=1655337600&v=beta&t=GMJuIzcHetlO1s-W5krxB3_GUon47tx0kNZX6eqNGR0,2022-03-15T06:23:44.933Z,https://www.linkedin.com/jobs/view/2927582884/,
Cloud Security Consultant,"Singapore, Singapore",,6,,2022-03-09T18:46:39.000Z,true,https://click.appcast.io/track/dep1bgn?cs=kqp&sjg=4evu,"Role Description
Participate, lead and jointly deliver security evaluation reports of solutions in cloud providers (AWS, Azure), and Software as Service solutions, as neededProvide domain expertise in security of public cloud and enterprise technologiesProvide recommendations for improvement and risk reduction by assessing cloud security posture; and act as a change agent with operations to secure infrastructure, platforms, and application Role requirements:
At least 8 years' Experience in IT SecurityAt least 3 years' Experience in Multi-Cloud Security Planning, Design and Implementation in areas like : Cloud firewalls & network segmentation. Cloud API Gateway Security Policies Cloud Web Application Firewall VM / Container security solutions (VMs, Containers, Functions) Directory Services Authentication & AuthorizationThe role coverage will include Asia market, strong fluency in mandarin language (reading, writing, speaking)
",false,Jobs via eFinancialCareers,https://www.linkedin.com/company/jobs-on-efinancialcareers,,Information Technology,Staffing & Recruiting,2022-04-08T18:46:38.000Z,Full-time,https://www.linkedin.com/jobs/view/2962291490/,https://media-exp1.licdn.com/dms/image/C560BAQHGMwEP_13neQ/company-logo_200_200/0/1619703231419?e=1655337600&v=beta&t=JfDehstunUwsUKS9hOOhAtlRVPDhOtX9L-grqGDGumk,2022-03-15T06:23:48.281Z,https://www.linkedin.com/jobs/view/2962291490/,
"Software Engineer (Global Distributed Table Storage), Cloud Infrastructure","Singapore, Singapore",6,73,https://www.linkedin.com/in/ACoAACBJyQMBG7vI0ZwiXv4EKEEq0-NYLg2fTV0,2022-02-24T09:06:54.000Z,false,https://careers.tiktok.com/position/7059225309329213726/detail,"TikTok is the leading destination for short-form mobile video. Our mission is to inspire creativity and bring joy. TikTok has global offices including Los Angeles, New York, London, Paris, Berlin, Dubai, Singapore, Jakarta, Seoul and Tokyo.
The Cloud Infrastructure team, based in Singapore, supports many of our star products and core business lines, serving hundreds of millions of users every day. We actively embrace open source and innovative software/hardware architecture, building a series of infrastructure to ensure the best R&D practices and enable the overall development of the company.
The Infrastructure NoSQL team faces all mid-platform and business lines in TikTok and its affiliates, operating across tens of thousands of servers and dealing with data far beyond the PB level. We have self-developed distributed kv/caching systems, global distributed tables storage systems and massive graph database products. Combined with the industry's new hardware and software stack technology, we strive for the continuous evolution of the next generation of products.
You will be responsible for the technical research and development of our self-developed global distributed table system (ByteTable) and open source HBase products. We are committed to building a globalized, high-performance, low-cost, and cloud native distributed table system to provide rich features for our applications.
Joining this team, you can look forward to a very structured training plan, as well as the opportunity to undertake a larger scope whilst giving enough space to grow and develop. We look forward to your application!

Responsibilities- Responsible for the design, development, performance tuning, new technology research, etc. of the distributed table system;- According to the needs of the business, design and improve the form system in terms of stability, function, performance, etc.;- Formulate development goals according to the project schedule, write detailed design documents and be responsible for module implementation, performance tuning, and functional testing;- Provide timely technical support for our online applications, extract potential needs and points of optimization from it, and continuously optimize the system.
Qualifications- Bachelor's/Master's Degree in Computer Science or related major;- Familiar with C++/Java program development (at least one), pursue high-quality code and focused on code engineering quality;- Solid knowledge of Linux system, proficient in multi-threading, network programming, and distributed development in any language;- In-depth understanding of database principles, proficient in key technologies of distributed storage and computing, and have practical experience with them;- Good at independent thinking, able to find problems proactively, and have systematic problem analysis and problem solving skills.
Preferred Qualifications- Active contributors to the open source community are preferred;- Familiarity with open source code such as RocksDB, HBase, TiDB, CockroachDB, ClickHouse, ScyllaDB, etc. is preferred;- Familiar with consistency protocols such as Paxos and Raft is preferred;- Learning, exploration and research capabilities in lesser known fields is preferred.",false,TikTok,https://www.linkedin.com/company/tiktok,,"Other, Management",Internet,2022-03-26T09:06:53.000Z,Full-time,https://www.linkedin.com/jobs/view/2936987970/,https://media-exp1.licdn.com/dms/image/C510BAQGCdThXIss7UQ/company-logo_200_200/0/1539940587971?e=1655337600&v=beta&t=fxKtBCnmKKYwlrgKn0lQ26W4vjNFf3aP1SwTxY_drXU,2022-03-15T06:23:51.569Z,https://www.linkedin.com/jobs/view/2936987970/,
"Regional Logistics Operations Lead, Google Cloud","Singapore, Singapore",183,1287,,2022-03-02T00:28:32.000Z,false,https://careers.google.com/jobs/results/88515065751184070-regional-logistics-operations-lead/?src=Online/LinkedIn/linkedin_us&utm_source=linkedin&utm_medium=jobposting&utm_campaign=contract,"Google will be prioritizing applicants who have a current right to work in Singapore, and do not require Google's sponsorship of a visa.

Minimum qualifications:
Bachelor's degree in Supply Chain Management, Business, Engineering, Operations or equivalent practical experienceExperience managing outsourced logistics operations.Experience in program management and in Warehouse Management System (WMS) deploymentsExperience supporting, supply chain logistics, network/data center acquisition, data center infrastructure procurement, and/or data center operations.

Preferred qualifications:
Master's degree in an engineering field, supply chain, or business intelligence.Experience with warehouse automation solutions.Ability to prepare and present detailed documented business cases to stakeholders and management.Ability to make recommendations/solutions based on data analysis, critical thinking and logic.Solid analytical skills, with ability to define and influence success metrics.Demonstrated analytical, organizational, and project management skills, using relevant information to make timely and critical decisions

About The Job

As the Asia Pacific (APAC) Regional Lead for Logistics Operations for Google Cloud, you will be responsible for logistics activities across APAC including leadership and operational excellence for distribution operations. This includes warehousing, safety, security, spend management, inventory management, supporting warehouse automation, continuous improvement, and orchestrating excellence across our extensive and complex third-party logistics network across all the APAC regions.

Behind everything our users see online is the architecture built by the Technical Infrastructure team to keep it running. From developing and maintaining our data centers to building the next generation of Google platforms, we make Google's product portfolio possible. We're proud to be our engineers' engineers and love voiding warranties by taking things apart so we can rebuild them. We keep our networks up and running, ensuring our users have the best and fastest experience possible.

Responsibilities

Lead and develop a distributed team of logistics professionals across APAC.Ensure the right metrics are driving the right results for Logistics in serving our stakeholders with speed and efficiency through data analytics, business case development, and presentation skills including budget oversight.Lead and continuously improve all warehousing operations including receiving, shipping, inventory management, supporting warehouse automation including warehouse management systems, material requirements planning systems (MRP), and final mile delivery to the data centers/mini-clusters ensuring safety, security, quality and compliance is front and center.Establish and maintain strategic supplier management through an extensive complex third-party logistics provider network across APAC, proactively ensure capacity, resources and risk mitigation plans in place.Develop productive and meaningful relationships with all key internal business partners to innovate on key strategic programs to improve speed and quality of execution.

Google is proud to be an equal opportunity workplace and is an affirmative action employer. We are committed to equal employment opportunity regardless of race, color, ancestry, religion, sex, national origin, sexual orientation, age, citizenship, marital status, disability, gender identity or Veteran status. We also consider qualified applicants regardless of criminal histories, consistent with legal requirements. See also Google's EEO Policy and EEO is the Law. If you have a disability or special need that requires accommodation, please let us know by completing our Accommodations for Applicants form .",true,Google,https://www.linkedin.com/company/google,,"Management, Manufacturing","Information Services, Internet",2022-04-01T00:28:31.000Z,Full-time,https://www.linkedin.com/jobs/view/2934680382/,https://media-exp1.licdn.com/dms/image/C4D0BAQHiNSL4Or29cg/company-logo_200_200/0/1519856215226?e=1655337600&v=beta&t=GMJuIzcHetlO1s-W5krxB3_GUon47tx0kNZX6eqNGR0,2022-03-15T06:23:54.515Z,https://www.linkedin.com/jobs/view/2934680382/,
Technical Product Management - Cloud Product and Database,"Singapore, Singapore",20,224,,2022-03-11T11:24:10.000Z,false,https://careers.shopee.sg/job-detail/2836,"About The Team

As a Technical Project Manager for Shopee cloud products, you will work in a team responsible for researching, designing and implementing Shopee private cloud platform, to design, deliver and promote our products and support our fast-growing business. As a Technical Project Manager for Shopee database administration, you will be responsible for analysing Shopee database usage, preparing database optimisation, as well as dealing with Disaster Recovery (DR) plans.

You will manage and improve existing processes, directly influence the direction of our products, and be responsible for communication around your projects. You will interact with a wide variety of Shopee engineers, product managers, and non-technical staff on a regular basis.

Job Description
Conduct the entire Shopee technical product life cycle from requirements gathering, implementation to deploymentEngage platform users, define and design product features and content, and work closely with teams across ShopeeMaintain Shopee infrastructure stability by setting and enforcing operation standards and controlsPrioritise requirements from stakeholders such as application system developers, technical operation engineers, etcEstablish clear milestones with visible progress regularly to ensure timely product/project deliveryAdvise technical management; coordinating design, migration, and integrationDrive the end-to-end release process for multiple, regular releases, and unplanned hotfix releasesDrill with Shopee Infrastructure Team for Shopee databases and Shopee Cloud product and deal with Disaster Recovery (DR) planning, setup, managementPlan IT infrastructure for major marketing events (e.g. 11.11 sales), including planning resource, improving technical product and database performance, and coordinating stress tests

Requirements
Bachelor's degree in Computer Science, a related technical field or equivalent practical experience1 - 3 years working experience in software development, project management or product management would be highly preferred Bilingual in English and Mandarin to collaborate with stakeholders from different regions Experience in project management and coordinating/driving release schedulesExperience supporting or driving technical programs in network deployment/engineering, product design, network content delivery or data center networking within telecommunications or Internet industries would be preferred Experience working with cloud components to develop highly scalable and available systems including APIs, automation, and data warehousing/analytics would be preferred Knowledge or demonstrated experience with software/cloud applications would be preferred",false,Shopee,https://www.linkedin.com/company/shopee,,"Engineering, Information Technology",Internet,2022-05-15T00:20:39.000Z,Full-time,https://www.linkedin.com/jobs/view/2838136931/,https://media-exp1.licdn.com/dms/image/C560BAQHUX3TD93JE7w/company-logo_200_200/0/1640256870457?e=1655337600&v=beta&t=47D0XooVFAQNtKyg0on59swug2ygnZJF0D1kVhwPQuE,2022-03-15T06:23:57.992Z,https://www.linkedin.com/jobs/view/2838136931/,
