jobTitle,jobLocation,applicantsCount,viewsCount,jobPosterProfileUrl,postedAt,appliesClosed,applyUrl,jobDescription,remoteAllowed,companyName,companyUrl,matchedSkills,jobFunctions,jobIndustries,appliesClosedAt,jobType,jobUrl,jobImageUrl,timestamp,query,error
"Intern, Product Engineer","Singapore, Singapore",19,287,,2022-02-28T10:40:05.000Z,false,https://marvell.wd1.myworkdayjobs.com/MarvellCareers/job/Singapore/Intern--Product-Engineer_2102383?src=SNS-102&source=LinkedIn,"About Marvell

At Marvell, we believe that infrastructure powers progress. That execution is as essential as innovation. That better collaboration builds better technology. Trusted by the world’s leading technology companies for 25 years, we move, store, process and secure the world’s data with semiconductor solutions designed for our customers’ current needs and future ambitions. Through a process of deep collaboration and transparency, we’re ultimately changing the way tomorrow’s enterprise, cloud, automotive, and carrier architectures transform—for the better.

The data infrastructure that our customers build has never been more critical to our global economy. It’s what’s keeping the world connected, businesses running, and information flowing. If you’re ready to excel, innovate, and truly enjoy your work, apply now for the position detailed below.

The Opportunity

Marvell connects the connected car with high quality AEC-Q100 qualified products and solutions that include Marvell’s first to market combo Wi-Fi /Bluetooth solution pioneering the Marvell Mobile Hotspot as an automotive use case, built-in Audio Codec, storage, bridges, and Ethernet domains providing automotive infotainment, wired/ wireless connectivity and co-application processor platforms that function in the following applications: Automotive Ethernet, Automotive Wireless, Automotive Storage.

Today’s bandwidth-intensive online lifestyle—from cloud-centric networks to streaming video—requires high-performance with uncompromised quality. Legacy broadband is based on copper infrastructures such as DSL, an aging technology with high maintenance costs that is running out of bandwidth. Optical access is now taking stage to better address the demands of these networks. Marvell’s optical broadband AVANTA™ family features highly integrated solutions that leverage key Marvell technologies—PON, Ethernet and packet processing, voice processing, power management, and application processors. AVANTA SoCs also include special power management modes that reduce power based on usage and coupled with latest Alaska® Gigabit PHYs support the EEE standard.

Marvell switching solutions have been driving a change in networks from the traditional methods of simply moving bits to delivering exciting services and applications. By delivering a stream of technical innovations through a diverse set of fast-growing product lines, Marvell technology is powering the next-generation network.

Job Responsibilities
Perform new device characterization, circuit sensitivity analysis, interpret findings & support root-cause investigations.Perform data mining and statistical data analysis on wafer sort and final test parametric to support initial product assessment. Perform functional testing and analysis to ensure product operation and reliability. Plan and coordinate (data analysis, debug, root-cause, implementing solutions) yield & test time improvement activities to meet the set mass production release goals.Support & resolve Test engineering & program related issues.Setup & transfer new product & technology to test locations in Asia for mass production.Support & resolve Product engineering & device testing related issues.Maintain and enhance product test yield & quality of devices in final test, system level test as well as wafer & bump sort.Perform cost reduction activities e.g., product yield improvement, test insertion elimination, test time reduction, multiple test site enhancement & wafer sort implementation.Continuous improvement for product quality, test efficiency, production throughput & test hardware improvement 
Requirements
Candidate MUST be currently pursuing a BS/MS (preferred) degree in Electronics/Electrical Engineering or related technical field(s)Good Knowledge of C, C++ programing languageHands-on knowledge on scripting languages such as VBA, Perl and Python are a plus
The Perks

With competitive compensation and great benefits, you will enjoy our workstyle within an incredible culture. We’ll give you all the tools you need to succeed so you can grow and develop with us. For additional information on what it’s like to work at Marvell, visit our Careers page.

Your Future

Marvell provides a work environment that promotes employee growth and development. We are searching for an individual who wants to grow with the company and will strive to improve performance. If you are driven, personable, and energetic, there will be additional opportunities for you here at Marvell.

All qualified applicants will receive consideration for employment without regard to race, color, religion, sex, national origin, sexual orientation, gender identity, disability or protected veteran status.

",false,Marvell Technology,https://www.linkedin.com/company/marvell,,"Engineering, Information Technology",Semiconductors,2022-04-17T09:09:17.000Z,Full-time,https://www.linkedin.com/jobs/view/2877727478/,https://media-exp1.licdn.com/dms/image/C4D0BAQEr2LHKnAfX2g/company-logo_200_200/0/1625155978548?e=1655337600&v=beta&t=YDOHOGa8PI_CwDJIr6-qk0HoosUoE2HLNTpdTYr4yIQ,2022-03-14T07:35:17.765Z,https://www.linkedin.com/jobs/view/2877727478/,
Senior Salesforce Developer,"Singapore, Singapore",13,62,https://www.linkedin.com/in/ACoAACW3yWsBjisJbqMezFAwEn78zqGzlOjIQIo,2022-03-11T08:48:06.000Z,false,https://jobs.lever.co/ninjavan/31e33d81-2d42-4e55-a627-54032405d89f/apply?lever-source=LinkedInJobs,"Ninja Van is a late-stage logtech startup that is disrupting a massive industry with innovation and cutting edge technology. Launched 2014 in Singapore, we have grown rapidly to become one of Southeast Asia's largest and fastest-growing express logistics companies. Since our inception, we’ve delivered to 100 million different customers across the region with added predictability, flexibility and convenience. Join us in our mission to connect shippers and shoppers across Southeast Asia to a world of new possibilities. 
More about us: - We process 250 million API requests and 3TB of data every day.- We deliver more than 1.5 million parcels every day.- 100% network coverage with 1000+ hubs and stations in 6 SEA markets (Singapore, Malaysia, Indonesia, Thailand, Vietnam and Philippines), reaching 500 million consumers.- 600,000 active shippers in all e-commerce segments, from the largest marketplaces to the individual social commerce sellers.- Raised more than US$500 million over five rounds.
We are looking for world-class talent to join our crack team of engineers, product managers and designers. We want people who are passionate about creating software that makes a difference to the world. We like people who are brimming with ideas and who take initiative rather than wait to be told what to do. We prize team-first mentality, personal responsibility and tenacity to solve hard problems and meet deadlines. As part of a small and lean team, you will have a very direct impact on the success of the company.
We are looking for talented and self-motivated Senior Salesforce developers to be part of Ninja Van’s salesforce team supporting an implemented and highly customized Salesforce Organisation. The work involves custom development with Salesforce Lightning, Apex, Visualforce on the Force.com platform. We also work on Sales, Service, Marketing Clouds and Einstein Analytics.
You will work closely with business leaders and manage end-to-end implementation for these large change requests, and for any other further enhancements required that are integral to ensuring that the organization’s processes are smooth and efficient.
ResponsibilitiesResponsible for gathering requirements, solution and design reviews, integration and data approach, release management methodology, fit/gap analysis of product capabilities, adoption approach, and best practices related to use of the Salesforce.com platform and guidance around adoption of Salesforce functionality.Responsible for designing, coding, developing, integrating and implementing enhancements to the Salesforce system.Responsible for providing oversight of support for existing developed functionalities by support developers.Additional ResponsibilitiesResponsible for preparing formal project documentation including requirements specifications, system design documents, Current & Future state diagrams, test cases and user manual.Participating in new initiatives/projects discussion with the business and converting them into an opportunity.RequirementsA proven technical background, with at least 5 years of experience in implementation and support of secure, stable and flexible tenant designs for Salesforce cloud product solutions with good exposure to SDLC processes.Salesforce certifications: Salesforce Admin, Platform Dev 1 and Service Cloud Consultant is preferred.Has experience in writing configuration documents, preparing technical and functional specification documents, and delivering documentation to be used for future reference.Skills in analyzing and resolving issues, including the ability to conduct related research and work with the end users to raise Salesforce Customer incidents as needed.Good communication skills (written and verbal), proven team player, rolling up the sleeves and getting involved in the nitty gritty.Familiar with Agile Methodology.",false,Ninja Van,https://www.linkedin.com/company/ninja-van,,"Engineering, Information Technology",Logistics & Supply Chain,2022-04-10T08:48:06.000Z,Full-time,https://www.linkedin.com/jobs/view/2951991074/,https://media-exp1.licdn.com/dms/image/C560BAQFymnfYMrhPGA/company-logo_200_200/0/1634018577403?e=1655337600&v=beta&t=v4wqgzjQJYZJg7qb6wpSak6rTKFxxrYDxJ35r6MbRJs,2022-03-14T07:35:20.765Z,https://www.linkedin.com/jobs/view/2951991074/,
Campus Recruitment & Program Intern (APAC),"Singapore, Singapore",70,455,,2022-03-04T08:31:20.000Z,false,https://boards.greenhouse.io/foodpandasingapore/jobs/4003487?s=LinkedIn&source=LinkedIn,"This is a full-time internship opportunity starting in May 2022

At foodpanda, we're on a mission to redefine how tech, food, people and culture are connected. Operating in more than 400 cities across 12 locations worldwide, foodpanda continues to expand and grow in its core food delivery business as well as in new verticals like grocery deliveries, with a strong tech infrastructure at its core. From our restaurants-partners, cloud kitchens and cloud grocery stores — foodpanda is just one tap away, delivering everything you need quickly and conveniently to your doorstep.

We are looking for an enthusiastic and driven intern to join our  Talent Acquisition Team . This is an exciting opportunity for someone who is keen to learn and grow your interest in HR. You’ll be part of a highly collaborative team where you can gain hands-on work experience and get involved in exciting campus recruitment and program projects.

What's On The Menu For You
 Participate in the campus recruitment process, focusing on sourcing ideal candidates for fresh graduate and internship roles.  Assist in planning and coordinating campus recruitment events (i.e campus presentations, workshops, networking sessions, competitions, virtual recruiting drives etc.)  Support with the planning, delivery and facilitation of young talent engagement activities for interns and graduates (i.e onboarding, workshops, masterclass, networking events and review processes etc.)  Proactively think of new ways to improve the internship and graduate program.  Any other ad hoc tasks as assigned 
What You Bring To The Table
 Pursuing a bachelor’s degree in Business, HR, Marketing, Events Management or similar fields  Strong problem-solving skills, attention to detail and ability to communicate effectively  Proficient with Microsoft Office tools (ie Word, Powerpoint) or the equivalent in Google Suite  Good team player, positive attitude, motivated and eager to learn  Have a passion for talent acquisition and people engagement  Able to commit to at least 3 months full-time internship
What We Offer
 A dynamic and challenging work environment.  A company committed to developing you personally and professionally.  A great working atmosphere with regular company and team events.  A vibrant and international team committed to diversity and inclusion.  Responsibility from day one in a fast-growing and global company.  Other benefits include free food and learning and development opportunities!",false,foodpanda,https://www.linkedin.com/company/foodpanda,,Human Resources,Internet,2022-04-03T08:31:19.000Z,Internship,https://www.linkedin.com/jobs/view/2940275008/,https://media-exp1.licdn.com/dms/image/C560BAQFgeYO7xdsT4w/company-logo_200_200/0/1646548678006?e=1655337600&v=beta&t=nRcnl8U4tTNd9UEz2i9V1IhiF4ERXHSHp5S6_5tB7YI,2022-03-14T07:35:23.895Z,https://www.linkedin.com/jobs/view/2940275008/,
Specialist - Big Data Engineering,"Singapore, Singapore",9,50,,2022-01-29T15:25:18.000Z,false,https://jobs.msd.com/gb/en/job/MSD1GBR161666ENGB/Specialist-Big-Data-Engineering?utm_source=linkedin&utm_medium=phenom-feeds,"Job Description

Specialist, Big Data Engineering 
 Opportunity to be a part of IT Engineering, Development & Integration organization in Singapore! Based in Singapore, the regional hub for Asia Pacific (AP) and top-ranked biopharmaceutical company on The Straits Times and Statista’s list of Best Employers in Singapore for two consecutive years (2020, 2021). Join the premier biopharmaceutical company that has been in Singapore for more than 25 years and in AP for over 60 years.
Our IT team operates as a business partner proposing ideas and innovative solutions that enable new organizational capabilities. We collaborate internationally to deliver the services and solutions that help everyone to be more productive and enable innovation.

Join us in the digital health revolution and tackle biggest opportunities and challenges at the intersection of healthcare, information and technology. Become a member of our IT Global Innovation Network in the heart of Singapore with start-up atmosphere and flat, friendly and collaborative environment. Enjoy a reward that technology careers don’t often bring the satisfaction of helping to save lives.

We are seeking energetic, forward-thinking Big Data Developer that will work on the collecting, storing, processing, analyzing and visualizing of huge sets of data of disparate formats and data sources and integrating them into a single data lake for further visualization.

What You Will Do

The primary focus will be on choosing the appropriate big data technology, tool sets and frameworks to deliver optimal solutions to use for these purposes.

Besides great atmosphere and flexible working environment, we also offer
 Competitive remuneration Position in a leading global healthcare company Challenging career Professional growth based on performance Innovative and flexible working environment Wide range of benefits
What You Must Have

To be successful in this role, you will have

Education Minimum Requirement 

MSc Degree or BSc Degree with relevant experience in Computer Science or related field with 3-5 years of relevant experiences.

Required Experience And Skills

Proven record of both backend data engineering and development with the following skills
 Automation and Implementation of end-to-end ETL process of unstructured datasets. Hands on experience in Hadoop, MapReduce, HDFS, Hive, Spark. Experience with various messaging systems, at least one of the following, Kafka, RabbitMQ or its equivalent. Good knowledge in back-end programming languages, Java, Python, shell scripting, SQL, etc. Translate complex functional and technical requirements into detailed design. Minimum 3 years of working experience in both frontend and backend development on data-heavy projects (ie, data engineering and programming experience) Excellent knowledge of relational (SQL) and non-relational databases (no-SQL) as well as Big Data technology like HDFS, Hive, Sparks. Able to design optimal data model for different use-cases with or without Big Data technology. Advance skill in SQL or other data query languages and working experience in tuning queries for data retrieval. Hands-on experience in building data pipelines or ETL flows. Hands-on experience with either two of the following databases Hive, Postgresql, AWS RedShift, DynamoDB, MongoDB. Hands-on experience with AWS Cloud Services. Experience with any data visualisation tools like spotfire, qliksense, Microsoft Power BI, etc a plus. Ability to investigate and propose alternative technology and architecture. Strong project management and organizational skills.
Preferred Experience
 Experience in Git versioning, CI/CD process for deployment of applications (Eg Jenkins). Experience developing dashboards using JavaScript frameworks like Angular, ReactJS, D3.js and others Proficient with programming language like Node.JS or Java EE/Spring platforms.
Our Support Functions deliver services and makes recommendations about ways to enhance our workplace and the experience of working at our organization. Our Support Functions include HR, Finance, Information Technology, Legal, Procurement, Administration, Facilities and Security.

Who We Are

We are known as Merck & Co., Inc., Kenilworth, New Jersey, USA in the United States and Canada and MSD everywhere else. For more than a century, we have been inventing for life, bringing forward medicines and vaccines for many of the world's most challenging diseases. Today, our company continues to be at the forefront of research to deliver innovative health solutions and advance the prevention and treatment of diseases that threaten people and animals around the world.

What We Look For

Imagine getting up in the morning for a job as important as helping to save and improve lives around the world. Here, you have that opportunity. You can put your empathy, creativity, digital mastery, or scientific genius to work in collaboration with a diverse group of colleagues who pursue and bring hope to countless people who are battling some of the most challenging diseases of our time. Our team is constantly evolving, so if you are among the intellectually curious, join us — and start making your impact today.

Current Employees apply HERE

Current Contingent Workers apply HERE

Search Firm Representatives Please Read Carefully 

Merck & Co., Inc., Kenilworth, NJ, USA, also known as Merck Sharp & Dohme Corp., Kenilworth, NJ, USA, does not accept unsolicited assistance from search firms for employment opportunities. All CVs / resumes submitted by search firms to any employee at our company without a valid written search agreement in place for this position will be deemed the sole property of our company. No fee will be paid in the event a candidate is hired by our company as a result of an agency referral where no pre-existing agreement is in place. Where agency agreements are in place, introductions are position specific. Please, no phone calls or emails.

Employee Status 

Regular

Relocation 

No relocation

VISA Sponsorship 

Yes

Travel Requirements

Flexible Work Arrangements 

Shift 

Valid Driving License 

Hazardous Material(s) 

Number of Openings 

1

Requisition ID R161666",false,MSD,https://www.linkedin.com/company/msd-global,,"Analyst, Information Technology","Biotechnology, Pharmaceuticals, Veterinary",2022-03-25T15:25:18.000Z,Full-time,https://www.linkedin.com/jobs/view/2935540152/,https://media-exp1.licdn.com/dms/image/C4E0BAQFy-V1JOLPIdQ/company-logo_200_200/0/1625578195772?e=1655337600&v=beta&t=fJPqqMWa11mBaDTr2ZMOtAqTgCWkzS6ykKHNkTMP6MI,2022-03-14T07:35:27.605Z,https://www.linkedin.com/jobs/view/2935540152/,
Research Associate (Engineering/Computer Science),"Singapore, Singapore",0,0,,2022-02-02T17:42:15.000Z,false,https://ntu.wd3.myworkdayjobs.com/en-US/Careers/job/NTU-Novena-Campus-Singapore/Research-Associate--Engineering-Computer-Science-_R00003182-1,"Rehabilitation Research Institute of Singapore invites applications for the position of Research Associate.

Key Responsibilities
D atabase design, creation, administration, maintenance and documentation of all data related services related to the Ability Database Infrastructure 
Job RequirementsMaster's in Engineering, Computer Science or related field of studiesCandidates with Bachelor's are welcome to applyAbility to develop and deploy database services on the cloud is requiredFull stack development experience would be an advantage:Development on linux and andriod platformExperience with the MEAN stack capabilitiesFamiliarity with open source, web-based projects will be a bonusExcellent client-facing and internal communication skillsExcellent written and verbal communication skillsVery good organizational skills including attention to detail and multitasking skillsFamiliarity with the Singapore healthcare environment will be an advantage
We regret that only shortlisted candidates will be notified.


Hiring Institution: NTU


In line with Singapore’s nationwide Vaccination-Differentiated Safe Management Measures (VDS), employees must be fully vaccinated to return to the workplace, unless certified to be medically ineligible. For Information on VDS, please click here .",false,Nanyang Technological University Singapore,https://www.linkedin.com/school/ntusg/,,"Engineering, Information Technology",Higher Education,2022-03-29T17:42:15.000Z,Full-time,https://www.linkedin.com/jobs/view/2932297378/,https://media-exp1.licdn.com/dms/image/C560BAQFMtLFt_Lfxrw/company-logo_200_200/0/1634620535113?e=1655337600&v=beta&t=OkSUCSo9B54RG2hzj3aZDZOCHpLA55A19b4qDXmlLGo,2022-03-14T07:35:30.312Z,https://www.linkedin.com/jobs/view/2932297378/,
