jobTitle,jobLocation,applicantsCount,viewsCount,jobPosterProfileUrl,postedAt,appliesClosed,applyUrl,jobDescription,remoteAllowed,companyName,companyUrl,matchedSkills,jobFunctions,jobIndustries,appliesClosedAt,jobType,jobUrl,jobImageUrl,timestamp,query,error
Business Development Manager (Google Cloud),"Singapore, Singapore",27,108,https://www.linkedin.com/in/ACoAAB3FrnQBjd4aP3FIR2cyxAFXrH081YmeKsE,2022-03-08T05:13:19.000Z,false,https://www.linkedin.com/job-apply/2946217867,"As a Google Cloud Platform (GCP) Business Development Director at iZeno, your mission is to develop mindshare within the assigned territories and proliferate enterprise adoption of GCP’s Cloud Infrastructure and Cloud-native services and solutions across Application Modernization, Big Data, Google Kubernetes Engine (GKE), APIgee, Anthos and Google Workspace.
Job DescriptionDrive awareness and business growthParticipate actively in all aspects of growing the business, including but not limited to strategic planning, demand generation & new account acquisition
Job RequirementsMinimum 5 years’ professional experience and proven track record in Business Development and/or Field Sales roles.An entrepreneurial mindset to rapidly build a business around one of the fastest growing Global Cloud providers.A great network in ASEAN a major plus.Google Cloud Platform co-sell and Google Cloud Platform partnership knowledge is a plus.Understanding of different Google Commercial programs and their related processes.A good grasp of how various Google incentive programs can support customers’ cloud transformation.Proven network/relationship management with Google ASEAN stakeholders.Ambitious with a go-getter attitude – The ability to influence and support Google Cloud Platform sales and campaigns and to create new opportunities.
Interested candidates please provide the following information in your application:In your last few employment, what is the industry that you are specialised in? In your last few employments, please share about 5 – 10 accounts under your careWhat is your quota managed and attainment in your last 2 roles? What is your expected annual package? 
We regret that only shortlisted candidates will be notified.",false,iZeno Pte Ltd,,,,,2022-09-04T05:12:30.000Z,Full-time,https://www.linkedin.com/jobs/view/2946217867/,,2022-03-14T04:04:27.028Z,https://www.linkedin.com/jobs/view/2946217867/,
Brand Partner Specialist - Cloud Platform,"Singapore, Singapore",0,13,,2022-03-11T22:54:22.000Z,false,https://ibm.contacthr.com/103477261?Codes=SN_LinkedIn,"532635BR

Introduction

At IBM, work is more than a job - it's a calling: To build. To design. To code. To consult. To think along with clients and sell. To make markets. To invent. To collaborate. Not just to do something better, but to attempt things you've never thought possible. Are you ready to lead in this new era of technology and solve some of the world's most challenging problems? If so, lets talk.

Your Role and Responsibilities

Cloud Platform ecosystems spans all the IBM Ecosystems routes of Build (ISV, MSP, Developers, etc), Service (SIs), Sell (resellers and distributors). The person is responsible to drive revenue and programs with these partners.

Primary focus (70% of time)

Deliver and exceed your monthly revenue commitments. Primary measurement being on a 55-45 sales planMaintain a robust pipeline including opportunities in existing accounts as well as driving net new business with prospectsBuild business plans and jointly close a pipeline of customer opportunities developed with our partners.Drive Cloud focussed sales plays around Satellite, VMware, SAP migration, etc.Work with partners to win new to IBM logosHelp partners by prospecting among IBM customer base. Execute on outbound prospecting, sales tactics, and IBM programsAchieve goals and strategic objectives including revenue, pipeline, training and repeatable solutionsManage complex contract negotiations and serve as liaison to the other groups.Everyday focus on keeping the CRM and related tools up-to-date. Aligning to global and regional mgmt. systems and participating in regular reviews.Be the IBM Cloud ambassador at the customer for your partnerPrimary Territory coverage – Singapore and other ASEAN countries. Also responsible to manage local networks for wider ASEANZK market.

Build focus (10% of time)

Identify, qualify, and enable high-value partners that drive revenue and deliver best-in-class solutions on IBM Cloud.Onboard and develop Technology Partners including Start-ups, SaaS providers, PaaS providers, established ISVs

Service focus (10% of time)

Effectively engage C & SVP level business & technical executives within the GSI's within APAC to gain top down sponsorshipDevelop and execute detailed joint APAC account business plans which have been agreed and signed off with the aligned GSI/s

Sell programs focus (10% of time)

Develop a group of committed partners aligned to targeted sales plays, repeatable offerings. Plan to educate and measure them in the region by keeping up programmatic engagement eg. QBR, Exec meetings, etc

Ideal Candidate

Enterprise B2B sales experience with channel management backgroundComfortable building and managing multiple relationships, handle overlapping account dynamics, with complex deal managementTrained in digital sales and social sales techniquesComfortable with end customer conversationsDrive to build and progress pipelines with the partners. “Work the phones” type of a person

Required Technical and Professional Expertise

As shared above

Preferred Technical And Professional Expertise

As shared above

About Business Unit

IBM has a global presence, operating in more than 175 countries with a broad-based geographic distribution of revenue. The company’s Global Markets organization is a strategic sales business unit that manages IBM’s global footprint, working closely with dedicated country-based operating units to serve clients locally. These country teams have client relationship managers who lead integrated teams of consultants, solution specialists and delivery professionals to enable clients’ growth and innovation. By complementing local expertise with global experience and digital capabilities, IBM builds deep and broad-based client relationships. This local management focus fosters speed in supporting clients, addressing new markets and making investments in emerging opportunities. Additionally, the Global Markets organization serves clients with expertise in their industry as well as through the products and services that IBM and partners supply. IBM is also expanding its reach to new and existing clients through digital marketplaces.

Your Life @ IBM

Are you craving to learn more? Prepared to solve some of the world's most unique challenges? And ready to shape the future for millions of people? If so, then it's time to join us, express your individuality, unleash your curiosity and discover new possibilities.

Every IBMer, and potential ones like yourself, has a voice, carves their own path, and uses their expertise to help co-create and add to our story. Together, we have the power to make meaningful change – to alter the fabric of our clients, of society and IBM itself, to create a truly positive impact and make the world work better for everyone.

It's time to define your career.

About IBM

IBM’s greatest invention is the IBMer. We believe that through the application of intelligence, reason and science, we can improve business, society and the human condition, bringing the power of an open hybrid cloud and AI strategy to life for our clients and partners around the world.

Restlessly reinventing since 1911, we are not only one of the largest corporate organizations in the world, we’re also one of the biggest technology and consulting employers, with many of the Fortune 50 companies relying on the IBM Cloud to run their business.

At IBM, we pride ourselves on being an early adopter of artificial intelligence, quantum computing and blockchain. Now it’s time for you to join us on our journey to being a responsible technology innovator and a force for good in the world.

Location Statement

For additional information about location requirements, please discuss with the recruiter following submission of your application.

Being You @ IBM

IBM is committed to creating a diverse environment and is proud to be an equal opportunity employer. All qualified applicants will receive consideration for employment without regard to race, color, religion, gender, gender identity or expression, sexual orientation, national origin, genetics, pregnancy, disability, age, veteran status, or other characteristics. IBM is also committed to compliance with all fair employment practices regarding citizenship and immigration status.",false,IBM,https://www.linkedin.com/company/ibm,,Sales,Computer Hardware,2022-04-10T22:54:21.000Z,Full-time,https://www.linkedin.com/jobs/view/2966689628/,https://media-exp1.licdn.com/dms/image/C4D0BAQHnDb1Rq_7PNQ/company-logo_200_200/0/1645010927195?e=1655337600&v=beta&t=4qD-9PI9uHtuOIaoswWKg0oHSDyZygH6Ov_V2uEU7N4,2022-03-14T04:04:30.295Z,https://www.linkedin.com/jobs/view/2966689628/,
"Cloud Communication Solution, Byteplus","Singapore, Singapore",1,73,,2022-03-03T09:24:51.000Z,false,https://jobs.bytedance.com/en/position/7055337883461339423/detail,"About Bytedance

Founded in 2012, ByteDance's mission is to inspire creativity and enrich life. With a suite of more than a dozen products, including TikTok, Helo, and Resso, as well as platforms specific to the China market, including Toutiao, Douyin, and Xigua, ByteDance has made it easier and more fun for people to connect with, consume, and create content.
 Responsible for the construction of SMS business commercialization, export commercialization programs to promote internal and external major customer ; Insight into the development of the SMS industry, provide product capability improvement solutions, and promote the introduction of resource cooperation ; Responsible for customer service construction, doing a good job in customer service management, Improving customer service robustness and customer experience. Who You Are Bachelor degree or above, At least 3 years of enterprise communication technology service experience; Understand the business form and product logic of the communications industry, and have been engaged in related technical services; Strong communication skills, with the ability to work systematically with surrounding teams and cross-departmental teams, and be able to break through innovation and seek collaborative resources; Strong pressure resistance, able to adapt to a high-intensity working environment, have the awareness of actively challenging difficulties and effectively promote the landing of the project; Working experience in operators and related enterprise communication service providers is preferred.",false,ByteDance,https://www.linkedin.com/company/bytedance,,"Marketing, Public Relations, Writing/Editing",Internet,2022-04-02T09:24:50.000Z,Full-time,https://www.linkedin.com/jobs/view/2937690157/,https://media-exp1.licdn.com/dms/image/C560BAQGA-1ynUGnhlA/company-logo_200_200/0/1600334313022?e=1655337600&v=beta&t=nJI4S06HEsSHzKWURMYLcljP4_eC5Al4-xCEISIGaRA,2022-03-14T04:04:33.684Z,https://www.linkedin.com/jobs/view/2937690157/,
Cloud Communication Manager,"Singapore, Singapore",2,53,,2022-03-13T14:51:34.000Z,false,https://www.aplitrak.com/?adid=YW5tb2xzaW5naC45NDc4NS4xNTUwQHBhZ2VzZy5hcGxpdHJhay5jb20,"This is a cloud communication Manager role role with a multinational company in Singapore. They are looking for candidates with experience in Cloud communication with SMS Business.

Client Details

Our client is technology company operating a range of content platforms that inform, educate, entertain and inspire people across languages, cultures, and geographies. They have a portfolio of Applications available in over 150 Markets and 75 Languages.

Description

As a Cloud Communication Manager, you will be responsible for:

Be responsible for the systematic resource management of SMS business, promote the systematic landing of product capabilities, and be responsible for the daily management, coordination and optimal use of resources;Responsible for insight and analysis of enterprise communication related products and solutions, combined with the current product situation to provide customers with competitive solutions and assist in tracking customer business docking, online, after-sales;Have a clear understanding of the current situation of SMS business resources, having strong sensitivity, and optimize and reasonably allocate solutions for business output resources;Have in-depth thinking on competition, sales mode and price system sales, and formulate reasonable solutions for optimization according to the current form and stage of products.Profile

As a successful candidate you will have a bachelor's degree in Computer Science or equivalent with at least 5 years of working experience in enterprise communication technology service. Understand the business form and product logic of the communications industry, and have been engaged in related technical services.Strong communication skills, with the ability to work systematically with surrounding teams and cross-departmental teams, and be able to break through innovation and seek collaborative resources.

Job Offer

You will be part of an organisation that sees value in investing in its employees. Stability in your career is a key for them; hence you'll be a great fit if this is one of the key values to you. The remuneration for this role will be competitive and in line with the market.


",false,Michael Page,https://www.linkedin.com/company/michael-page,,Information Technology,Information Technology & Services,2022-04-12T14:51:33.000Z,Full-time,https://www.linkedin.com/jobs/view/2969308343/,https://media-exp1.licdn.com/dms/image/C4D0BAQHHyXXIeVo_hA/company-logo_200_200/0/1647016299516?e=1655337600&v=beta&t=Yyg7AULWDr5JE0vixdnMK9fKwFZg8jUIeKeYHhzhkn8,2022-03-14T04:04:37.915Z,https://www.linkedin.com/jobs/view/2969308343/,
Specialist Cloud Analytics,"Singapore, Singapore",0,21,,2022-03-13T17:37:12.000Z,false,https://careers.bhp.com/job/Specialist-Cloud-Analytics/852246000/,"About BHP

At BHP we support our people to grow, learn, develop their skills and reach their potential. With a global portfolio of operations, we offer a diverse and inclusive environment with extraordinary career opportunities. Our strategy is to focus on creating a safe work environment where our employees feel strongly connected to our values and objectives, and where the capability of our people is key to our success. Come and be a part of this success.

About The Role

As the Cloud Analytics - Operations Specialist, you will own the Cloud platform’s analytics service that will utilise a data-driven approach to identify improvement opportunities across governance & compliance, sustainability, reliability & performance efficiency, operations excellence, cost optimisation, security improvements, and toil reduction. You will build close relationships with stakeholders from FinOps, Cybersecurity, Cloud Operations/SREs, Cloud Engineers, Cloud Governance and Customer to qualify and prioritize these opportunities that will unlock business value for BHP.

Working side by side with the other Product Owners within the team you will ensure these improvement initiatives are well understood and represented throughout the demand and prioritization processes. You will have overall accountability for the defining the mechanism and identification of these business insights and improvement opportunities of the Cloud Platform and the value it delivers to each customer.

Key Responsibilities Include
Define, implement, maintain, and evolve the Cloud’s Analytics Service Platform that supports hybrid multi-cloud data aggregation, data management, data transformation, and data presentation.Perform analysis and generate insights based on a data-driven approach to identify improvement opportunities across governance & compliance, sustainability, reliability & performance efficiency, operations excellence, cost optimisation, security improvements, and toil reduction.Develop a prioritized pipeline of improvements to ensure we deliver maximum value with the capacity available and realise specific outcomes for BHP.Perform process analysis and identify areas of process improvements through simplification or automation.Prepare management reports on the value creation through data insights and improvement initiatives.
About You

As the successful candidate you will possess the following:
STEM Bachelor’s degree highly desirable Strong communication skills with comfort in speaking with business stakeholdersExperience in managing geographically disperse technical teams and working with senior stakeholders, vendors and partners collaborativelyExperience in leading and developing product teams to implement workloads in the public cloud, ideally with multiple cloud providersExperience in data management.Believes in a non-hierarchical culture of collaboration, transparency, safety, and trust Experience leading with teams in an agile setting preferred
About Our Process

At BHP, we are committed to employing individuals who align with the BHP Charter Values and meet the requirements of the role. As part of the recruitment process, there are a number of checks which may be conducted to demonstrate applicants suitability for a role including police / criminal background checks, medical, drug and alcohol testing, due diligence checks, right to work checks, and/or reference checks.

BHP also requires employees in Australia to be fully vaccinated against Covid-19 to ensure the safety and wellbeing of our people (from the 31st of January 2022 or earlier depending on relevant state health directives). If you are applying for a role at BHP please consider this new requirement when submitting your application. BHP will also adhere to any relevant health directives that may be made that affects our workforce. For further information please see our website (LINK)

Supporting a Diverse Workforce

The size and magnitude of our business not only provides significant opportunity for professional development, but also attractive salary packages with performance based bonuses and unique BHP employee share program.

At BHP, we recognise that we are strengthened by diversity. We are committed to providing a work environment in which everyone is included, treated fairly and with respect. We are an Equal Opportunity Employer and encourage applications from all qualified applicants regardless of race, colour, sex, national origin, age, religion, people with disabilities, sexual orientation, gender identity, protected veteran status, citizenship, genetic information or other protected status under federal, state or local laws.

We know there are many aspects of our employees' lives that are important, and work is only one of these, so we offer benefits to enable your work to fit with your life. These benefits include flexible working options, a generous paid parental leave policy, other extended leave entitlements and parent rooms.

All qualified applicants will receive consideration for employment without regard to race, color, sex, national origin, age, religion, disability, sexual orientation, gender identity, protected veteran status, citizenship, genetic information or other protected status under federal, state or local laws.

BHP is an Equal Opportunity Employer - Minorities/Females/Veterans/Disability.",false,BHP,https://www.linkedin.com/company/bhp,,"Research, Analyst, Information Technology",,2022-04-12T17:37:11.000Z,Full-time,https://www.linkedin.com/jobs/view/2953649728/,https://media-exp1.licdn.com/dms/image/C4D0BAQELDYAj2D7aWw/company-logo_200_200/0/1519856126206?e=1655337600&v=beta&t=Hs3cai68SNfuLhyWBCDm19HlJVg0Hytgo49vsp-Yw6o,2022-03-14T04:04:41.068Z,https://www.linkedin.com/jobs/view/2953649728/,
Internship: Data Analyst (Jul/Aug to Dec),"Singapore, Singapore",72,423,,2022-03-10T00:00:00.000Z,false,https://ibm.contacthr.com/103389257?Codes=SN_LinkedIn,"498532BR

Introduction

At IBM, work is more than a job - it's a calling: To build. To design. To code. To consult. To think along with clients and sell. To make markets. To invent. To collaborate. Not just to do something better, but to attempt things you've never thought possible. Are you ready to lead in this new era of technology and solve some of the world's most challenging problems? If so, lets talk.

Your Role and Responsibilities

Join and contribute to our supply chain resiliency initiative to improve real-time assessment and decision making capability. Enable stakeholders proactively anticipate and respond to disruptive events.

ResponsibilitiesIdentify and understand various data sources and support in data collection i.e. supplier, customer, market dataIntegrate data from various sources into standardized formats for purpose of analysisBuild descriptive and predictive analysis and enable supply chain resiliency investigationDescriptive analysis: build IBM Supply Chain resiliency metricsPredictive analysis: design models to predict supply chain resiliencyAutomate analysis process and put in place a routine schedule for analysisMaintain documentation of work 

Job Requirements

Basic Skill (SQL, Python/SPSS Modeler, ETL)Required Skill (Machine Learning, like Supervised Learning, Unsupervised Learning)Optimization skills would be a plus

Required Technical and Professional Expertise

Undergoing a Masters or Bachelor in Computer Science, Data Analytics major or related studiesAcademic exposure with PythonAcademic / project exposure in web crawling, text mining Familiar with DB2 (preferred), SQL or mySQLFamiliar with Web Development

Preferred Technical And Professional Expertise

As above.

About Business Unit

IBM Systems helps IT leaders think differently about their infrastructure. IBM servers and storage are no longer inanimate - they can understand, reason, and learn so our clients can innovate while avoiding IT issues. Our systems power the world’s most important industries and our clients are the architects of the future. Join us to help build our leading-edge technology portfolio designed for cognitive business and optimized for cloud computing.

Your Life @ IBM

Are you craving to learn more? Prepared to solve some of the world's most unique challenges? And ready to shape the future for millions of people? If so, then it's time to join us, express your individuality, unleash your curiosity and discover new possibilities.

Every IBMer, and potential ones like yourself, has a voice, carves their own path, and uses their expertise to help co-create and add to our story. Together, we have the power to make meaningful change – to alter the fabric of our clients, of society and IBM itself, to create a truly positive impact and make the world work better for everyone.

It's time to define your career.

About IBM

IBM’s greatest invention is the IBMer. We believe that through the application of intelligence, reason and science, we can improve business, society and the human condition, bringing the power of an open hybrid cloud and AI strategy to life for our clients and partners around the world.

Restlessly reinventing since 1911, we are not only one of the largest corporate organizations in the world, we’re also one of the biggest technology and consulting employers, with many of the Fortune 50 companies relying on the IBM Cloud to run their business.

At IBM, we pride ourselves on being an early adopter of artificial intelligence, quantum computing and blockchain. Now it’s time for you to join us on our journey to being a responsible technology innovator and a force for good in the world.

Location Statement

For additional information about location requirements, please discuss with the recruiter following submission of your application.

Being You @ IBM

IBM is committed to creating a diverse environment and is proud to be an equal opportunity employer. All qualified applicants will receive consideration for employment without regard to race, color, religion, gender, gender identity or expression, sexual orientation, national origin, genetics, pregnancy, disability, age, veteran status, or other characteristics. IBM is also committed to compliance with all fair employment practices regarding citizenship and immigration status.

",false,IBM,https://www.linkedin.com/company/ibm,,Information Technology,Computer Hardware,2022-04-09T22:30:14.000Z,Full-time,https://www.linkedin.com/jobs/view/2964942254/,https://media-exp1.licdn.com/dms/image/C4D0BAQHnDb1Rq_7PNQ/company-logo_200_200/0/1645010927195?e=1655337600&v=beta&t=4qD-9PI9uHtuOIaoswWKg0oHSDyZygH6Ov_V2uEU7N4,2022-03-14T04:04:44.198Z,https://www.linkedin.com/jobs/view/2964942254/,
