jobTitle,jobLocation,applicantsCount,viewsCount,jobPosterProfileUrl,postedAt,appliesClosed,applyUrl,jobDescription,remoteAllowed,companyName,companyUrl,matchedSkills,jobFunctions,jobIndustries,appliesClosedAt,jobType,jobUrl,jobImageUrl,timestamp,query,error
DevsecOps Engineer,"Singapore, Singapore",0,15,,2022-03-08T20:00:16.000Z,false,https://ibm.contacthr.com/101579209?Codes=SN_LinkedIn,"502864BR

Introduction

As a DevsecOps Engineer, you will lead IBM into the future by translating system requirements into the design and development of customized systems in an agile environment. The success of IBM is in your hands as you transform vital business needs into code and drive innovation. Your work will power IBM and its clients globally, collaborating and integrating code into enterprise systems. You will have access to the latest education, tools and technology, and a limitless career path with the world’s technology leader. Come to IBM and make a global impact!

Your Role and Responsibilities

Work along with the Project teams to onboard new squads in the DevOps environment. Guiding the continuous integration, continuous deployment and continuous testing.Work closely with the development team and operation team to create DevOps strategy and toolset that suits the individual squads.Setup, deploy and maintain scalable, high availability systemsPerform and automate deployment and security hardening of systemsAutomate and build up scalable systems/environment using latest technologies (e.g. Kubernetes)Automate security hardening in testing, deployment and production setup based on industrial best practicesSetup and maintain CI/CD, automated testing, development and delivery environmentsWriting scripts/programs for service monitoring and health check of systems Day-to-day monitoring, backup, deployment and maintenance of systems

Required Technical and Professional Expertise

Diploma/Degree in Electrical Engineering, Computer Science, Communications Engineering or equivalentMinimum 3 years in software development industry or server infrastructure setupExperience in software-defined infrastructure (OpenStack, CloudStack, VSphere).Experience with infrastructure provision tools (Docker, Ansible, Puppet, Chef etc.).Good understanding of hardware infrastructure systems (network switches, firewalls, routers etc.) and Linux operating system.Basic understanding of DevOps principles and practices. Knowledge in DecSecOps will be an added advantage.Self-motivated and good communication skills. Good hands-on experience on using AWS Cloud Formation scripts for configuration management and application deployment.At least 1-year experience working closely with infrastructure. Experience in Linux, Windows, network troubleshooting is a plus,Experience on working in an Agile environment, in a close collaboration with developers, Knowledge on continuous integration, test automation, version control, and software configuration managementExcellent communication skills

Preferred Technical And Professional Expertise

Experience with cloud orchestration, configuration management and auto-scaling techniques Thorough knowledge of networking, routers, switches, and WiFi setup.Good knowledge of storage technologies, such as NAS, SAN, SDSExperience with automation tools such as Salt/Chef/Puppet/AnsibleExperience with load balancing setup for TCP/IP, HTTP, DNS, routings.Knowledge of IT security standards, for instance from CIS or IM8. Experience on building and developing CI/CD pipeline and workflow (Gitlab CI/CD preferred) Good hands-on experience on using AWS Cloud Formation scripts for configuration management and application deployment Overall knowledge on one or more of the following programming language (Java, Spring Boot, Node JS, Angular JS, React Native) Knowledge on continuous integration, test automation, version control, and software configuration management.

About Business Unit

IBM Consulting is IBM’s consulting and global professional services business, with market leading capabilities in business and technology transformation. With deep expertise in many industries, we offer strategy, experience, technology, and operations services to many of the most innovative and valuable companies in the world. Our people are focused on accelerating our clients’ businesses through the power of collaboration. We believe in the power of technology responsibly used to help people, partners and the planet.

Your Life @ IBM

What matters to you when you’re looking for your next career challenge?

Maybe you want to get involved in work that really changes the world? What about somewhere with incredible and diverse career and development opportunities – where you can truly discover your passion? Are you looking for a culture of openness, collaboration and trust – where everyone has a voice? What about all of these? If so, then IBM could be your next career challenge. Join us, not to do something better, but to attempt things you never thought possible.

Impact. Inclusion. Infinite Experiences. Do your best work ever.

About IBM

IBM’s greatest invention is the IBMer. We believe that progress is made through progressive thinking, progressive leadership, progressive policy and progressive action. IBMers believe that the application of intelligence, reason and science can improve business, society and the human condition. Restlessly reinventing since 1911, we are the largest technology and consulting employer in the world, with more than 380,000 IBMers serving clients in 170 countries.

Location Statement

For additional information about location requirements, please discuss with the recruiter following submission of your application.

Being You @ IBM",false,IBM,https://www.linkedin.com/company/ibm,,Information Technology,Computer Hardware,2022-04-07T20:00:15.000Z,Full-time,https://www.linkedin.com/jobs/view/2959798206/,https://media-exp1.licdn.com/dms/image/C4D0BAQHnDb1Rq_7PNQ/company-logo_200_200/0/1645010927195?e=1655337600&v=beta&t=4qD-9PI9uHtuOIaoswWKg0oHSDyZygH6Ov_V2uEU7N4,2022-03-14T10:50:30.136Z,https://www.linkedin.com/jobs/view/2959798206/,
Cloud Engineer,"Singapore, Singapore",0,11,,2022-03-11T23:39:23.000Z,false,https://www.mycareersfuture.gov.sg/job/information-technology/cloud-engineer-doo-capital-market-sg-f886fb2f3af4c8154c130779c2acca6d,"Responsibilities & Duties
Plan, build and manage the private cloud data centre structure in Equinix Hong Kong and London.Plan, build and manage the VMware structure on the private cloud.Plan, build, monitor and manage the hardware in Equinix Hong Kong and London.Plan, build and optimize the IP Transit and BGP network.Prepare and maintain technical specification and documents, drawings and system documentation.Monitor the operation of the networks and system to ensure proper utilization of line, hardware and software.Direct and manage information technology strategic plans, policies and programs for business to accomplish corporate goals, growth and objectives.Oversee the development, design, and implementation of new technologies and changes to the existing IT environment.Assess new computing technologies to determine the potential value for the company and discover ways to gain competitive advantage.Hybrid cloud infrastructure network planning for global business, cloudy interconnection design and high availability security network operation platform planning and construction, covering network monitoring design and analysis, network quality analysis combined with business network architecture design and tuning, to solve the company's production system Network troubles.
Requirements
Degree in Computer Science/Information Technology, Engineering or related fields, more than 8 years of related experience.Very solid and excellent knowledge of IT systems, infrastructure, visualization and network.Hard requirement: Proficient BGP, VMware NSX, Cisco Routers.Good at English speaking and writing, better with Cantonese and Mandarin.Good Professional Ethics & Moral Character.Strong people skills.Excellent leadership skills.",false,DOO CAPITAL MARKET SG PTE. LTD.,,,"Engineering, Information Technology",,2022-04-10T23:39:23.000Z,Full-time,https://www.linkedin.com/jobs/view/2966823420/,,2022-03-15T06:22:37.849Z,https://www.linkedin.com/jobs/view/2966823420/,
"Senior Software Engineer, Data Mining Infrastructure","Singapore, Singapore",0,2,,2022-03-09T22:06:19.000Z,false,https://www.mycareersfuture.gov.sg/job/engineering/senior-software-engineer-data-mining-infrastructure-motional-singapore-40d7184c563fd07c0c5bafba61aadce4,"The Data Mining team in Singapore develops cutting edge algorithms and infrastructure for data mining and data verification in the context of autonomous driving. Our goal is to improve the on-road performance of products that use machine learning at their core by mining for errors, anomalies & long-tail events. We are looking for engineers passionate about autonomous driving technology and its potential impact to the world.

Motional's Machine Learning team has produced groundbreaking advancements in the autonomous vehicle industry including nuPlan (https://arxiv.org/abs/2106.11810), nuScenes (https://www.nuscenes.org), PointPillars (https://arxiv.org/abs/1812.05784), and PointPainting (http://arxiv.org/abs/1911.10150).

What You'll Be Doing
Work on large-scale solutions for mining challenging driving scenarios which help boost model performance across various autonomous driving tasksCollaborate with ML infrastructure teams and contribute to automated framework for continuous learning through iterative mining, training and deploymentBuild dashboards around data verification use cases to maximize cost efficiency and throughput of data annotation pipelineDevelop distributed large-scale pipelines and optimize internal tools & open-source libraries to run efficiently and robustly at production level
What We’re Looking For
MS in Computer Science, related quantitative field or equivalent experienceExperience architecting and deploying large-scale systemsExperience with tools for data manipulation, storage and visualizationExperience with dashboard building libraries for data analyticsExperience with core AWS services or similar cloud platformsExperience with writing production-quality code in PythonAt least 4 years of software development experience
Bonus Points
Experience with machine learning or statistical analysisExperience with building infrastructure for machine learningExperience with distributed systems design and architectureExperience with high-performance system optimization and deployment",false,MOTIONAL SINGAPORE PTE. LIMITED,,,"Engineering, Information Technology",,2022-04-08T22:06:19.000Z,Full-time,https://www.linkedin.com/jobs/view/2962407474/,,2022-03-15T06:22:40.709Z,https://www.linkedin.com/jobs/view/2962407474/,
Data Engineer (APAC),"Singapore, Singapore",13,98,,2021-12-15T12:49:30.000Z,false,http://jobs.en-sg.teksystems.com/fTYDTw/data-engineer-apac-itcommunications-singapore-other-15058685?sref=linkedin.com&ecid=jb_linkedin&directToApply=true&sref=linkedin.com.au,"We are looking for high-calibre Data Engineers to be a part of a growing tech firm!

This is a Permanent opportunity.

The Position
Experience in designing and building robust and highly scalable data pipelines Strong programming proficiency using 1 or 2 of the following languages: Python or Golang Strong understanding of building data models Clear understanding of distributed computing, especially in databases Hands-on in SQL with a deep understanding of query optimization Exposure to Machine Learning / Artificial intelligence is a plus Good to have: Experience working on any of the Cloud platforms (GCP, AWS, Azure) Strong communications skills 
What’s in it for you?
Exposure to the latest cutting-edge technologies Rewarding work: Opportunity to make real and immediate impact on the business and the industry You'll work with a great team. They're exceptional at their jobs, and winning market share from their competitors every day. Fun, friendly, open, start-up company culture 
We regret to inform that only shortlisted candidates will be notified / contacted.

For more information you can email Nicole Sichon in our Singapore office on Nicole.Sichon@teksystems.com quoting Job Reference NicoleSichon529420 or alternatively, apply here to register your interest.

http://jobs.en-sg.teksystems.com/fTYDTw/data-engineer-apac-itcommunications-singapore-singapore-15058685

Job Reference: Nicole Sichon 529420

EA Registration No.: R1873628, Sichon Andreana Nicole Ong

Allegis Group Singapore Pte Ltd, Company Reg No. 200909448N, EA License No. 10C4544",false,TEKsystems,https://www.linkedin.com/company/teksystems,,Information Technology,Information Technology & Services,2022-04-09T06:50:02.000Z,Full-time,https://www.linkedin.com/jobs/view/2869837530/,https://media-exp1.licdn.com/dms/image/C560BAQHvWB-HshcNtA/company-logo_200_200/0/1625161122996?e=1655337600&v=beta&t=eeQbxHCsZkMR3MnQYbL5F_bODyoAtWkQVFZ0TE5TQa8,2022-03-15T06:22:43.620Z,https://www.linkedin.com/jobs/view/2869837530/,
"Telecom BSS/OSS Business Development Leader, ASEAN","Singapore, Singapore",13,94,,2022-03-10T10:48:08.000Z,false,https://www.amazon.jobs/jobs/1975731/telecom-bss-oss-business-development-leader-asean?cmpid=SPLICX0248M&utm_source=linkedin.com&utm_campaign=cxro&utm_medium=social_media&utm_content=job_posting&ss=paid,"Job Summary

DESCRIPTION

Would you like to enable transformations at some of the largest telecom operators in the world? Amazon Web Services (AWS) is a dynamic and rapidly growing business within Amazon and the leader in providing secure, reliable, scalable, and innovative cloud services that help businesses across the globe scale and grow. The AWS Telecom Business Development team is looking for a seasoned Telecom industry leader with experience in advising, winning and delivering innovative network transformation solutions for Telecom service providers.

This is a senior role within the Asia-Pacific & Japan (APJ) team, to guide customers in accelerating their digital transformations by building networks that leverage a software-based architecture, and enabling business outcomes leveraging AWS’ telecom-supportive technologies. You will help our telecom customers accelerate this journey by engaging with the customers' business and technology stakeholders to create a compelling vision AWS services in their environment; helping them learn from examples of industry leaders, reference architectures and define what “great” looks like for their enterprise.

This role may be located in Singapore, Jakarta, Kuala Lumpur or Manila, and will strive to create alignment among customer stakeholders, address resistance to change and provide a tangible, executable vision to transition to a cloud computing model. This leader will operate effectively at multiple levels of the organization and can address concerns across C-suite executives, IT/Network/Procurement leaders and established platform teams.

Areas Of Expertise Will Include Most Of The Following
 In-depth understanding across Telecommunications systems, standards & processes Granular understanding of the economics of network operations including BSS/OSS considerations and Telco IT strategy Deep familiarity with OSS, Multi-Mediation, Multi-Activation, Service Orchestration, offline and online Billing, Order management and customer experience management domains. Firm grasp of Network Function Virtualization (NFV) and various Virtual Network Function (VNF) technologies Executive level network transformation proposal structuring, presentation & negotiation, including in consortiums with partners
You will represent the AWS telecom strategy and be the leading voice for AWS telecom-focused solutions. You will leverage worldwide programs, campaigns and work closely with the wider AWS business development, product management, marketing, solutions architecture, partner and professional services teams to position the AWS telecom data strategy for telecom customers and partners.

Responsibilities Will Include
 Providing business transformation and digital technology adoption thought leadership to Telecom customers & partners Conducting C-level executive workshops; engaging and leading strategic discussions with senior telecom industry leaders regarding networks transformation Helping Telcos identify transformational opportunities and driving adoption of AWS solutions Identifying and scoping high impact transformation solutions with measurable business results for our customers Drive lighthouse OSS and BSS transformations leveraging cloud infrastructure and operating principles Work with multiple sales and technical teams within AWS and global technology solution providers for OSS and BSS applications to define and execute GTM initiatives. Engage each technology solution provider’s field sales organizations, channels and end customers to create and drive revenue opportunities for AWS. Ensure that there is a strategic business development plan for target markets, aligned with AWS’ strategic direction. Inventing and delivering new offers, collaborating with AWS professional services, service teams, partners, and Amazon product teams Providing telco thought leadership by participating in industry conferences and executive briefings Supporting client engagements within the assigned territory and influencing activities at our Geo Accounts Supporting our AWS Partner Network and key industry ISVs with their Telco solutions on AWS
The ideal candidate will possess a foundation of having directly led sales / pre-sales / consulting engagements and interactions at the highest levels of large telecom operators and technology partners. The candidate should have proven expertise at thought leadership, conceptualizing customer-centric solutions, convincing C-Level executives, CIOs/CTOs & line of business leaders and IT architects, and having seen through successful sales to delivery cycles.

Additionally, the ideal candidate will have a demonstrated ability to think strategically and long-term about the needs of complex global telecom businesses. The ideal candidate will also be deeply familiar with complex legacy IT environments, managed enterprise IT infrastructure services, telecom enterprise applications, and has done market analysis, deal negotiation/shaping, with an awareness of field enablement techniques.


Basic Qualifications
 Bachelor’s degree or equivalent experience in Computer Science, Engineering, Mathematics or a related field 15+ years of experience in client related interactions, including executive presentations, relationship management, deal structuring and commercials negotiation, including working with partners in a consortium framework Strong understanding of Telco IT and digital transformation, including the role of cloud, data strategy, AI/ML Demonstrated ability and track record leading Telco sales growth within a cross-functional team (direct reporting and virtual), in complex client engagements Track record of building rapport with senior partner and customer executives (e.g. CEO, CIO, CTO), building close relationships, and closing large revenue accounts. 7+ years experience with $100M+ deals in the Telco sector in sales or business development capacity Demonstrated experience designing winning proposals to address the re-architecture of legacy BSS/OSS platforms to be run on public cloud.
Preferred Qualifications
 Telco industry Business and Technical expertise across IT, OSS/BSS architectures and workloads, including ERP, CRM, Billing, Charging, Order Management, Catalogue Management, Mediation, Provisioning, Activation, Inventory Management, Service Assurance, Fault & Performance Management, Data Warehousing, Decision Support System, EAI/ESB Solutions Masters in Computer Science, Engineering, Mathematics or applicable field, or MBA Experience creating and executing organizational change management strategies as part of a larger transformation Program oversight experience in a Sales / Business Development capacity, including planning, prioritization, successful project completion and maintaining a focus on high standards and quality across own organization and partners Experience in evaluating on-premise vs cloud computing models
What if I’m not an expert in all the above? That’s okay. We hire people who have a passion for learning, and are curious to build, learn and grow. You will be supported in your career development here at AWS. You will have plenty of opportunities to build your technical, leadership, business and consulting skills. This will include formal and on the job training, and a chance to learn and upskill through AWS certification courses and mentorship. You will learn from and collaborate with some of the brightest technical minds in the industry today. If you want to work with the best cloud technologies from the world’s leading cloud provider, apply now. We can’t wait to see what you build here. Come build the future with AWS.

CULTURE AND COMMITMENT TO INCLUSION, DIVERSITY & EQUITY

At AWS, we welcome all builders. We believe that technology should be built in a way that’s inclusive, accessible, and equitable. We’re committed to putting in the work for more equal representation.

Amazon is committed to a diverse and inclusive workplace. Amazon is an equal opportunity employer, and does not discriminate on the basis of race, national origin, gender, gender identity, sexual orientation, disability, age, or other legally protected status.

Amazon is an equal opportunity employer, and does not discriminate on the basis of race, national origin, gender, gender identity, sexual orientation, disability, age, or other legally protected status.


Company - Amazon Web Services Singapore

Job ID: A1975731",false,Amazon Web Services (AWS),https://www.linkedin.com/company/amazon-web-services,,"Business Development, Information Technology","Computer Software, Information Technology & Services, Internet",2022-04-09T10:48:06.000Z,Full-time,https://www.linkedin.com/jobs/view/2963687187/,https://media-exp1.licdn.com/dms/image/C560BAQE_4UwvNNtNTQ/company-logo_200_200/0/1640205885683?e=1655337600&v=beta&t=MlDDChzrnrPCvlJTpz7hJgbAMGTzo2IhQ8UihPeCacE,2022-03-15T06:22:46.872Z,https://www.linkedin.com/jobs/view/2963687187/,
