jobTitle,jobLocation,applicantsCount,viewsCount,jobPosterProfileUrl,postedAt,appliesClosed,applyUrl,jobDescription,remoteAllowed,companyName,companyUrl,matchedSkills,jobFunctions,jobIndustries,appliesClosedAt,jobType,jobUrl,jobImageUrl,timestamp,query,error
"Cloud Inside Sales Representative, Australia and New Zealand","Singapore, Singapore",49,322,,2022-02-24T10:50:53.000Z,false,https://boards.greenhouse.io/acronis/jobs/5784620002?gh_src=42e18c722&s=LinkedIn&source=LinkedIn,"Acronis is a world leader in cyber protection—empowering people with cutting-edge technology that enables them to monitor, control, and protect the data that their businesses and lives depend on. We are in an exciting phase of rapid-growth and expansion and looking for a Cloud Inside Sales Representative who is ready to grow their career in the billion-dollar cybersecurity industry.

As the Cloud Inside Sales Representative, you will own the end-to-end sales process for signing new Service Providers to resell Acronis Data Cloud services across Australia and New Zealand. You will foster relationships and use your exceptional influencing skills across c-level executives, partners and distributors to drive qualifying leads, develop new business and expand revenue. You will work alongside passionate and dynamic sales, marketing and enablement teams from all over the world who are dedicated to your development and success through our onboarding and ongoing training program.

This is an extremely exciting opportunity for someone who is looking for a place to make real impact with the runway to develop new actions on the region and bring innovative ideas to the table. If you thrive in a fast-paced, high-volume environment, enjoy working in global teams and view every challenge as an opportunity, then this position is for you. Apply today to join #TeamAcronis!

What You'll Do
Attract new partners to sell Acronis services to existing customer base of the partnerDevelop sales opportunities by researching and identifying potential accounts; soliciting new accounts; building rapport, providing technical information and explanationsClose new sales/accounts by answering telephone, email inquiries, verifying and entering informationActively solicit for all leads and direct sales opportunities, referring leads as appropriate, and updates all sales opportunities into Salesforce Daily engagement with Acronis distributors
What You Bring
Fluent in English Minimum 1-3 years of experience where end to end sales was the main activityPrevious experience within tech or software sales, experience within security space highly valuedStrong closing sales skills and track record of success in quota-driven environment; experience and/or comfort with cold calling preferredAbility to effectively articulate product’s different features and answers any questions customers might haveCustomer-centric thinker with high level of discipline and ability to meet deadlines in a fast-paced environment while still maintaining a high-level of accuracyTeam-player and positive attitude, eager to do more and help out, views challenging situations as opportunities
Who We Are

Acronis is revolutionizing cyber protection by unifying backup, disaster recovery, storage, next-generation anti-malware, and protection management into one solution. This all-in-one integration removes the complexity and risks associated with non-integrated solutions and offers easy, complete and reliable data protection for all workloads, applications, and systems across any environment—all at a low and predictable cost.

Founded in Singapore in 2003 and incorporated in Switzerland in 2008, Acronis now has more than 2,000 employees and offices in 34 locations worldwide. Its solutions are trusted by more than 5.5 million home users and 500,000 companies, and top-tier professional sports teams. Acronis products are available through over 50,000 partners and service providers in over 150 countries and 26 languages.

Acronis is an equal opportunity employer. All qualified applicants will receive consideration for employment without regard to age, ancestry, color, marital status, national origin, physical or mental disability, medical condition, protected veteran status, race, religion, sex (including pregnancy), sexual orientation, gender identity or expression, or any other characteristic protected by applicable laws, regulations and ordinances.

",false,Acronis,https://www.linkedin.com/company/acronis,,"Sales, Business Development",Computer Software,2022-04-21T09:48:01.000Z,Full-time,https://www.linkedin.com/jobs/view/2848565790/,https://media-exp1.licdn.com/dms/image/C510BAQHpKxsqxdEWjg/company-logo_200_200/0/1519856602358?e=1655337600&v=beta&t=vdUVGTLfN7oBEXJS3jFbRrGXxnYO7yGAs5fh9TKsJPA,2022-03-14T09:12:21.964Z,https://www.linkedin.com/jobs/view/2848565790/,
"Assistant Manager/ Manager, Cloud Sales","Singapore, Singapore",10,64,,2022-03-09T08:34:53.000Z,false,,"You will be working with the pre-sales team in transforming the way we engage with customers and partners. You know the competitive landscape and implement strategies that maximize customer and partner value through use of cloud technology and drive growth.
You are a resourceful, people-focused and persistent individual, who takes rejection as a personal challenge to succeed when given opportunity. You appreciate the value of long lasting relationships and prioritise efforts to build trust with existing and potential customers.
This position requires interaction with other internal departments such as Pre-Sales, Sales Operations, and Customer Success.
Responsibilities:Sell the Cloud BU packaged products and services to new and existing clients (direct and through partners)Leverage and enhance partner relationships to drive additional value and revenue (sell with and sell through partners)Identify and effectively qualify Cloud opportunitiesWork with pre-sales consultants to discover, identify and meet customer requirementsPresent Cloud solutions to technical and business decision makers Manage sales cycles and multiple engagements simultaneously Lead negotiations and overcome objections for deal closurePrepare accurate sales forecasts and sales cycle reporting (using Salesforce CRM)
Requirements:Bachelor's Degree or equivalent business experience5+ years of sales or marketing experienceProven track record of consistently exceeding sales quotasSelf-driven, motivated and results orientedHigh levels of social perceptiveness and customer serviceExcellent communication, presentation, and negotiation skillsPossess cloud fundamental knowledge on Amazon AWS, Azure, or Google Cloud PlatformExperience in value-based enterprise sales methodology (SPIN Selling, Challenger Sales, Customer Centric Selling, etc)Experience selling major CSPs services i.e. AWS, Azure, GCP) IaaS, PaaS, SaaS and/or Cloud-based business solutions to commercial enterprise (SME and local Singapore Companies) Understanding of partner ecosystems including Cloud providers and the ability to leverage partner solutions to solve customer needsSuccessful experience developing SME market and large Singapore companies Proven prospecting and sales cycle management skillsAbility to effectively track sales activity in Salesforce CRMCertification in either AWS Cloud Certified Professional, AZ-900 or GCP Fundamentals (Core Infra)Prior work experience in a Sales position working with solutions that include ITSM, AIOps, machine learning, business analytics and data-lakeBroad Knowledge of Governance, Risk and Compliance: Identity management, security monitoring, various compliance frameworks, and a good understanding of core security concepts and processes as it relates to securing Cloud technologies",false,ST Engineering,https://www.linkedin.com/company/st-engineering,,"Engineering, Information Technology",Mechanical Or Industrial Engineering,2022-04-08T08:34:52.000Z,Full-time,https://www.linkedin.com/jobs/view/2955959885/,https://media-exp1.licdn.com/dms/image/C4D0BAQEm55jFujHL5A/company-logo_200_200/0/1519951259736?e=1655337600&v=beta&t=Y-5fq4ehNg-rrnVvCW6UKuFTGUQYkdiu7jujSKVkiiA,2022-03-14T09:12:25.019Z,https://www.linkedin.com/jobs/view/2955959885/,
Business Functions Application Consultant,"Singapore, Singapore",0,20,,2022-03-12T22:55:19.000Z,false,https://ibm.contacthr.com/103526240?Codes=SN_LinkedIn,"508298BR

Introduction

IBM Application Consultants work directly with our clients on key initiatives. You will have the opportunity to build an in-depth understanding of their business issues and implement organizational strategies that drive adoption of change. We are looking for experts who can build credibility and trust with our clients and provide knowledge that addresses individual and unique business needs.

Your Role and Responsibilities

As a Business Analyst In IBM, You Will

Analyse business needs, gaps and issuesRecommend best possible solutions to address the problem Stakeholder management and engagement for both internal, client and industry stakeholdersOverall accountability to ensure high quality and timely solution deliveryUnderstand and translate customer needs into business and technology solutions, providing consultation on the customer digital journey and digital transformationProvide implementation of design services through a range of digital methodologiesAnalyze as-is and to-be processes to define system/technology/business requirementsSupport user requirements capture and translation of requirements into business and digitally enabled solutionsSupport the delivery of quality functional/application digital designsSupport development and implementation of quality business digital solutions for the client

Required Technical and Professional Expertise

You are someone we are looking for if you have the following expertise:

Query data to understand user adoption and usage of SG Tech Stack products.Design, build, launch and maintain efficient, reliable and basic data pipelines to support understanding of users’ adoption and usage of the SG Tech StackSupport data cleansing and standardization to manage end-to-end data collection and analysisIntegrate and collate data silos in a manner which is both scalable and compliantDevelop new data extraction, transformation and loading processes in productionProvide data visualization as needed to aid in understanding the dataAssist with the interpretation of insights from the data to support decision makingFacilitation, negotiation and conflict resolution skills, and demonstrated success at building teams and relationships with key people in local and remote sites.Demonstrated sound interpersonal and communications skills.Understanding of the business processes and ability to detail them as needed by the project.Skilled in analysing and reengineering business processes and recommending solutions.Experience in facilitating workshops and brainstorming sessions to gather business requirements.

Preferred Technical And Professional Expertise

Bachelor’s Degree in Computer Science or have equivalent professional experienceMinimum 3 to 5 years’ experience in business analyst role or equivalent management consulting experience.Experience with query languages such as SQL, and Unix query tools such as awk or grep. Experience implementing batch and streaming data pipelinesSome understanding of DevOps tools such as BitBucket, Gitlab, and Bamboo Knowledge of big data analytical techniques would be a plus, such as map-reduce.Exhibit a data-driven mindset and able to communicate well with dataDemonstrate resourcefulness and creativity when working on data manipulation with common and basic tools likes excel, text editors, google sheetsMeticulous, strong analytical ability, documentation and project management skills.Good interpersonal, communication, decision-making skills and a responsible attitude.Ability to multi-task and work well under pressure.Any prior experience in Business Process Management projects and/or Agile Methodology will be beneficial.Knowledge and working experience with Cloud, AI Automation, Big Data technologies would be advantageous.

About Business Unit

IBM Consulting is IBM’s consulting and global professional services business, with market leading capabilities in business and technology transformation. With deep expertise in many industries, we offer strategy, experience, technology, and operations services to many of the most innovative and valuable companies in the world. Our people are focused on accelerating our clients’ businesses through the power of collaboration. We believe in the power of technology responsibly used to help people, partners and the planet.

Your Life @ IBM

Are you craving to learn more? Prepared to solve some of the world's most unique challenges? And ready to shape the future for millions of people? If so, then it's time to join us, express your individuality, unleash your curiosity and discover new possibilities.

Every IBMer, and potential ones like yourself, has a voice, carves their own path, and uses their expertise to help co-create and add to our story. Together, we have the power to make meaningful change – to alter the fabric of our clients, of society and IBM itself, to create a truly positive impact and make the world work better for everyone.

It's time to define your career.

About IBM

IBM’s greatest invention is the IBMer. We believe that through the application of intelligence, reason and science, we can improve business, society and the human condition, bringing the power of an open hybrid cloud and AI strategy to life for our clients and partners around the world.

Restlessly reinventing since 1911, we are not only one of the largest corporate organizations in the world, we’re also one of the biggest technology and consulting employers, with many of the Fortune 50 companies relying on the IBM Cloud to run their business.

At IBM, we pride ourselves on being an early adopter of artificial intelligence, quantum computing and blockchain. Now it’s time for you to join us on our journey to being a responsible technology innovator and a force for good in the world.

Location Statement

For additional information about location requirements, please discuss with the recruiter following submission of your application.

Being You @ IBM

IBM is committed to creating a diverse environment and is proud to be an equal opportunity employer. All qualified applicants will receive consideration for employment without regard to race, color, religion, gender, gender identity or expression, sexual orientation, national origin, genetics, pregnancy, disability, age, veteran status, or other characteristics. IBM is also committed to compliance with all fair employment practices regarding citizenship and immigration status.",false,IBM,https://www.linkedin.com/company/ibm,,Information Technology,Computer Hardware,2022-04-11T22:55:18.000Z,Full-time,https://www.linkedin.com/jobs/view/2968624195/,https://media-exp1.licdn.com/dms/image/C4D0BAQHnDb1Rq_7PNQ/company-logo_200_200/0/1645010927195?e=1655337600&v=beta&t=4qD-9PI9uHtuOIaoswWKg0oHSDyZygH6Ov_V2uEU7N4,2022-03-14T09:12:29.009Z,https://www.linkedin.com/jobs/view/2968624195/,
"Senior Infrastructure Engineer, Platforms","Singapore, Singapore",1,30,,2022-03-08T01:50:20.000Z,false,https://sggovterp.wd102.myworkdayjobs.com/en-US/PublicServiceCareers/job/Singapore/Senior-Infrastructure-Engineer--Platforms_JR-10000007354?source=Linkedin,"The Government Technology Agency (GovTech) aims to transform the delivery of Government digital services by taking an ""outside-in"" view, putting citizens and businesses at the heart of everything we do. We also develop the Smart Nation infrastructure and applications, and facilitate collaboration with citizens and businesses to co-develop technologies.

Join us as we support Singapore’s vision of building a Smart Nation - a nation of possibilities empowered through info-communications technology and related engineering.

Government Infrastructure Group (GIG)

The Government Infrastructure Group (GIG) is responsible for digital infrastructure that supports the Whole-of-Government (WOG). We are the infrastructure architects and engineers who architect, design and deliver an agile, secure and sustainable infrastructure which enables a digital government for Singapore.

How We Work

Aside from formulating the infrastructure strategy and roadmap at WOG level, we also develop prototypes using new technologies and establish standards and best practices to guide the design and implementation of information systems that support the enterprise infrastructure.

We examine factors such as people, culture, policies and processes to provide a secure, predictive and always-on platform, enabling public officers to work anywhere and anytime.

By leveraging on innovative Cloud and Saas technologies, we architect, design, build and deliver Cloud and Datacentre hosting environments and common services which support government agencies in accelerating and developing modern applications and services.

Transforming ICT infrastructure through modernisation and automation is also our key focus. Using latest technology and best practices, we deliver secure and utility-based services to WOG, so that government agencies can function efficiently and seamlessly.

We are also passionate about building and uplifting ICT engineering know-how for the WOG in critical infrastructure domains, which we advance through experimentation, prototype development, consultancy and training.

Job Overview

As a Senior Infrastructure Engineer, you will be responsible to manage the Big Data infrastructure that provides the compute, storage and data visualization platform. You will work with a team of data analyst and data engineers to provide driven insights for users from Whole-of-Government.

 What you will be working on: 
Lead as subject matter expert for data analytics compute solutions, storage and data visualization technologies.Designing, evaluating and implementing framework and platform that can handle the needs of a rapidly growing database.Architecting and scaling data analytics infrastructure, finding opportunities to improve and optimize workloads, processes to ensure that performance levels can support continuous accurate, reliable and timely delivery of data products.Manage continuous uptime of Data platform services by developing High availability tools and best practises.Manage the continuous testing and deployment of data pipelines, new data platform services and analytics dashboards.Manage and run highly critical production services who provides analytics capabilities to our various users across the WOG.Review and adopt relevant industry best practices for Government IT infrastructureEnsure that project implementation and operations are aligned to Government technology standards and policies

 What we are looking for: 
Degree in Data Science, Computer Science, Computer, Electronics Engineering, Information Technology or related disciplines.Minimum 5 years of hands on experiencing in big data infrastructure preferably in products such as Cloudera and QlikProficient in common big data tools like Hadoop, Spark, Kafka, Nifi in a large scale.Well versed in setting up continuous integration and deployment for big data or other projectsExcellent written and verbal communication and ability to influence and communicate effectively with non-technical audience and senior managementKeep abreast of ICT technologies, skillsets and industry practicesPreferably obtained certification in the following:o ITIL V3 Foundation certifiedo Cloudera Certified Associate (CCA) certifiedQlik Sense System Administrator certified

We are an equal opportunity employer and value diversity at our company as we believe that diversity is meaningful to innovation. Our employee benefits are based on a total rewards approach, offering a holistic and market-competitive suite of perks. This includes generous leave benefits to meet your work-life needs. We trust that you will get the job done wherever you are, and whatever works best for you – so work from home or take a break to exercise if you need to*. We also believe it’s important for you to keep honing your craft in the constantly-evolving tech landscape, so we provide and support a plethora of in-house and external learning and development opportunities all year round.
Subject to the nature of your job role that might require you to be onsite during fixed hours",false,GovTech Singapore,https://www.linkedin.com/company/govtech-singapore,,Information Technology,Information Technology & Services,2022-04-07T01:50:19.000Z,Full-time,https://www.linkedin.com/jobs/view/2945787799/,https://media-exp1.licdn.com/dms/image/C4D0BAQGT9Dy38Q2jdQ/company-logo_200_200/0/1519890805213?e=1655337600&v=beta&t=GlLnDaLmisjvCjn3Xn3G6A7Ri6vJdxmkibVcU_H-tIQ,2022-03-14T09:12:32.507Z,https://www.linkedin.com/jobs/view/2945787799/,
Lead Data Consultant - Cloud (AWS / Azure),"Singapore, Singapore",16,62,https://www.linkedin.com/in/ACoAAA60Vd4BTBBd1FYj0RWaSRzaY0KMUGzVibU,2022-02-24T07:35:07.000Z,false,https://www.linkedin.com/job-apply/2936747866,"Lead Data Consultant – Cloud (AWS / Azure)
Our company has partnered with a high growth Cloud Consulting Company. 
This is a chance for you to be part of a dynamic and exciting work environment to achieve your full potential.
Job Responsibilities 
Help deliver innovative solutions for our clients.Data Modernisation using AWS / Azure platformsKeep the customers and Company stakeholders regularly informed of your work progress.Build a positive reputation for yourself and for the Company.Work in various technologies (E.g., build a report in Power BI, an ETL pipeline in AWS, or perhaps some Big Data IoT solution)
Technology stack: Here is just some of the technology stack we work with and on for our customers:Azure DevOps and Git,Azure Data Factory, Purview and Synapse,AWS Glue/ LakeFormation,PowerBI,Azure Machine Learning,AWS SageMaker,AWS ElasticSearch,Google BigQuery,Databricks,SQL Server,Python, Spark, Jupyter, SQL and PowerShellAll things IoT, including Digital Twins,Hadoop and other open-source platforms.
Job Requirements 
8-10 years’ worth of experience in Data Engineering, Analytics or Science.Have an automation first mindset. CI/CD tooling, scripting and DevOps is in your DNA.Be proficient in parts of data engineering, analytics or sciences. For example, you may have worked with building machine learning models, built a data platform or two on Microsoft Azure/ AWS, ingested Big Data, made some nifty ETL pipelines, or created many reports in Power BI.Experience with Data Visualisation Tools (Tableau, Grafana, Chartist. js, FusionCharts, Datawrapper, Infogram, ChartBlocks, and D3. Js)Demonstrate the Company Beliefs.Work well in a team.Be coachable and pursue all opportunities to develop your skills and capabilities on engagements and in your professional development.
Sound like you?
For a confidential discussion please email hassaan.c@worldwide-rs.com
Due to a large volume of applicants, we regret to inform that only shortlisted candidates would be notified.
EA License: 20S0371 Registration No: R1545451",false,WRS - Worldwide Recruitment Solutions,https://www.linkedin.com/company/wrs-worldwide-recruitment-solutions,,"Information Technology, Consulting, Engineering",Information Technology & Services,2022-03-26T07:35:06.000Z,Full-time,https://www.linkedin.com/jobs/view/2936747866/,https://media-exp1.licdn.com/dms/image/C4D0BAQEvPwg-yzGiAA/company-logo_200_200/0/1553088174871?e=1655337600&v=beta&t=ktcZaIuPYL_8O5EZ2wZcnhWAMQxavH_wobuPDHuphGk,2022-03-14T09:12:36.153Z,https://www.linkedin.com/jobs/view/2936747866/,
